Topic,Article_Name
21,Burkert-2022-Decentralized Online Multiplayer,Cai-2019-Demo Abstract_ An Interoperable Avata,Chen-2022-ABSNFT_ Securitization and Repurchas,Delfabbro-2022-Understanding the mechanics and,Delic-2022-Profiling the Potential Risks and B,Fan-2022-CryptoArcade_ A Cloud Gaming System w,Jiang-2022-Economic Analysis of Loot Box Marke,Jiang-2022-Towards Understanding Player Behavi,Kedziora-2020-Anti-Cheat tool for detecting un,Komiya-2019-Increasing Motivation for Playing,Lee-2019-Is a Blockchain-Based Game a Game for,Lin-2022-A Peek at Metaverse Society from Web,Liu-2011-Security model of mobile online games,Manzoor-2020-Scavenger hunt_ Utilization of bl,Min-2019-Blockchain games_ A survey,Pfeiffer-2020-Blockchain Technologies and Game,Rottondi-2017-A privacy-friendly gaming framew,Scholten-2019-Ethereum crypto-games_ Mechanics,Scholten-2020-Inside the decentralised casino_,Serada-2020-Why Is CryptoKitties (Not) Gamblin,Serada-2022-Fairness by Design_ The Fair Game,Shcherba-2021-Blockchain and games_ A novel mi,Slavnenko-2021-Enhancing Privacy Through DMMA_,Tošić-2021-A DECENTRALIZED AUTHORITATIVE MULTI,Wang-2019-Rhythm dungeon_ A blockchain-based m,Wu-2020-Infinity Battle_ A Glance at How Block,Yaklai-2020-An architecture for game to game d,Yao-2022-Freedom and Restraint in Dark Forest_,Yu-2019-Re-thinking untraceability in the cryp,Yuen-2019-Proof-of-play_ A Novel Consensus Mod,Zhang-2022-DeFi '22_ ACM CCS Workshop on Decen,Zhao-2020-CloudArcade_ A blockchain empowered,da Silva-2021-Real and Virtual Token Economy A
22,Alamer-2018-A Privacy-preserving incentive fra,Ayaz-2020-A Voting Blockchain based Message Di,Ayaz-2021-A Proof-of-Quality-Factor (PoQF)-Bas,Ayaz-2021-Blockchain-Enabled Security and Priv,Ayaz-2022-A Blockchain Based Federated Learnin,Bhat-2020-Evaluation and design of performable,Bi-2023-IoT_ A Decentralized Trust Management,Bordel-2022-Distributed Trust and Reputation S,Chen-2021-Detecting Smart Contract Loopholes B,Cheng-2022-A Blockchain-Based Trust Model for,Dai-2018-Learning Based Security for VANET wit,Gupta-2022-Game Theory‐Based Authentication Fr,Hao-2012-Mixed-strategy game based trust manag,Hassija-2020-A Framework for Secure Vehicular,Hassija-2020-DAGIoV_ A Framework for Vehicle t,Merrad-2022-Robust Decentralized Proof of Loca,Motepalli-2021-Reward Mechanism for Blockchain,Rani-2022-Improvement of energy conservation u,Sharadqh-2023-Hybrid Chain_ Blockchain Enabled,Stodt-2023-Introducing a Fair Tax Method to Ha,TSP_CSSE_25461,Ying-2023-DVIT—A Decentralized Virtual Items T,Zhu-2020-An Improved Proof-of-Trust Consensus
23,Alwen-2021-Modular Design of Secure Group Mess,Arif-2020-A Blockchain-Based Multiplayer Trans,Arif-2021-A Scoring System for Multiplayer Gam,Arif-2023-Decentralized recommender system for,Bu-2020-Toward Blockchain-Assisted Gamified Cr,Bu-2021-Validating Knowledge Contents with Blo,Casado-Vara-2019-Blockchain-based distributed,Chernikov-2020-Waste management industry from,Ferreira-2019-A Blockchain and Gamification Ap,Fu-2019-Bead Strand Model_ a high-efficiency s,Gamidullaeva-2023-A Design Concept for a Touri,Ghanem-2022-FLoBC_ A Decentralized Blockchain-,Gürsoy-2020-Using blockchain to log genome dat,Kuehn-2021-A Practical Tool-Chain for the Deve,Lee-2023-Facing to Latency of Hyperledger Fabr,Ma-2019-Design of Routing Incentive Protocol f,Pradana-2022-A Multi-Criteria Recommender Syst,Smirnov-2019-Robot Coalition Formation Based o,Smirnov-2020-Usage of Smart Contracts with FCG
24,"Ahmad-2022-MOOC 5.0_ A Roadmap to the Future o","Alhojärvi-2020-Hacking finance_ experiments wi","Aysan-2021-Blockchain-based solutions in achie","Bala-2022-A novel game theory based reliable p","Batarlienė-2021-Claims solutions using a block","Bhattacharya-2023-Towards Future Internet_ The","Block-2021-The entrepreneurial finance markets","Blockchain for Business - 2021 - Tyagi - Ether","Blockchain for Business - 2021 - Tyagi - The S","Bonifazi-2023-Performing Wash Trading on NFTs_","Bucea-Manea-țon-2021-Blockchain technology enh","Bucea-Manea-țon-2022-Artificial Intelligence P","Campbell-2018-Digitalization of tax_ Epistemic","Canbay-2022-Privacy Concerns and Measures in M","Chen-2021-SmartStore_ A blockchain and cluster","Chen-2021-Trusted audit with untrusted auditor","Choi-2022-Blockchain-Centered Educational Prog","Choi-2022-Development of Blockchain Learning G","Çulha-2022-Gamification of Open Inquiry-based","Davidová-2022-Co-De_GT_ The Gamification and T","Delfabbro-2021-The psychology of cryptocurrenc","Elarabany-2022-Evaluating anti-obesity potenti","Feng-2022-An analysis of the current status of","Gambo-2021-Effect of the Fourth Industrial Rev","Gammon-2018-Experimenting with blockchain_ Can","González-Tablas-2020-Shuffle, cut, and learn_","Goyanes-2020-Value and Intelligence of Busines","Guidi-2022-Social games and Blockchain_ explor","Hudson‐smith-2022-Incoming Metaverses_ Digital","Hughes-2017-Blockchain, The Greater Good, and","Kosmarski-2021-Anthropology and blockchain","Kumar-2022-Evolving Role of Sustainable Procur","Lado-2019-Behavioral Dynamics and Regulation o","Liao-2018-Inkjet-Printed Random Lasers","Lin-2022-Metaverse in Education_ Vision, Oppor","Lischke-2016-Analyzing the bitcoin network_ Th","Machine Learning Approach for Cloud Data Analy","Mahapatra-2022-A Hybrid Connected Approach of","Martins-2019-Collaborative Gamified Approach f","Patrickson-2021-What do blockchain technologie","Peters-2021-Building human security and an ent","Pilipenko-2019-GABA-containing compound gammap","Polas-2022-Blockchain Technology as a Game Cha","Pu-2021-The Impact of Covid-19 on Blockchain A","Quantum Blockchain - 2022 - Dhanaraj - Post%E2","Rabieinejad-2021-Blockchain-based E-commerce f","Rahman-2019-A Blockchain-Based Non-Invasive Cy","Read-2020-Libra Project_ Regulators Act on Glo","Revolutionizing Tropical Medicine - 2019 - Atk","Sharma-2021-Game of names_ Blockchain premium","Silvestru-2022-Smart Academic and Professional","Thenjono-2022-The Business Prospect in Metaver","Thrassou-2022-An Overview of Business Advancem","Uribe-Saldarria-2022-What If_ A Robot Challeng","Valeonti-2021-Crypto collectibles, museum fund","Wang-2022-Attention Economy in Metaverse_ An N","Wang-2022-STSIIML_ Study on token shuffling un","Wang-2022-Toward Understanding Attention Econo","Weng-2019-Integrating the Combination of Block","Xu-2021-An Optimal Stability Matching Algorith","Yang-2022-Fusing Blockchain and AI With Metave","Yilmaz-2022-Examining the Use of Non-fungible","Zagar-2021-Distributed applications in gamific","Zandee-2022-Aiming for bullseye_ a novel gamep","Zheng-2022-Retraction Note_ Blockchain-based i"
25,"Abate-2021-SSProve_ A Foundational Framework f","Agrawal-2019-Attribute Based Encryption (and m","Alwen-2012-Collusion-preserving computation","Arapinis-2021-Astrolabous_ A Universally Compo","Badertscher-2021-A Rational Protocol Treatment","Bai-2016-Improved reduction from the bounded d","Bartoletti-2021-A Theory of Automated Market M","Bartoletti-2022-A THEORY OF AUTOMATED MARKET M","Baum-2016-How to prove knowledge of small secr","Belotti-2020-Game theoretical analysis of cros","Bentov-2021-Tortoise and Hares Consensus_ The ","Bhattacharyya-2023-Subversion Resilient Hashin","Bitansky-2013-Why _Fiat-Shamir for proofs_ lac","Bracciali-2021-Decentralization in open quorum","Braverman-2019-Optimal short-circuit resilient","Braverman-2022-Optimal Short-Circuit Resilient","Broadbent-2020-Towards quantum one-time memori","Broadbent-2021-Towards quantum one-time memori","Broadnax-2021-Environmentally Friendly Composa","Brzuska-2014-Using indistinguishability obfusc","Canetti-2012-Universally composable security w","Chen-2022-Maximal Information Propagation via ","Chongchitmate-2017-Resettably-sound resettable","Ciampi-2022-FairMM_ A Fast and Frontrunning-Re","Ciet-2004-Transient fault induction attacks on","Dachman-Soled-2014-A black-box construction of","David-2018-21 - Bringing down the complexity_","Dubovitskaya-2021-A Game-Theoretic Analysis of","Elumar-2021-On the Connectivity and Giant Comp","Fouque-2004-Blockwise Adversarial Model for On","Gambs-2015-The crypto-democracy and the trustw","Ganesh-2022-Secure Auctions in the Presence of","Gao-2019-BFR-MPC_ A blockchain-based fair and","Garay-2020-Resource-Restricted Cryptography_ R","Hall-Andersen-2021-Game Theory on the Blockcha","He-2021-Fair Peer-to-Peer Content Delivery via","Hubáček-2013-Limits on the power of cryptograp","Ishai-2012-On efficient zero-knowledge PCPs","Jafargholi-2017-Be adaptive, avoid overcommitt","Kamath-2021-On Treewidth, Separators and Yao’s","Kiayias-2021-Coalition-safe equilibria with vi","Kozachinskiy-2020-Multiparty Karchmer - Wigder","Kumaresan-2015-How to use bitcoin to play dece","Kırlar-2018-A game-theoretical and cryptograph","Lu-2019-On enabling machine learning tasks ato","Lu-2020-Generic superlight client for permissi","Maji-2021-Computational Hardness of Optimal Fa","Mazorra-2022-Price of MEV_ Towards a Game Theo","Mazumdar-2022-Strategic Analysis of Griefing A","McMenamin-2021-Achieving state machine replica","McMenamin-2022-FairTraDEX_ A Decentralised Exc","Mittelbach-2014-Salvaging indifferentiability","Nabi-2020-Game-Theoretic Analysis of an Incent","Naito-2016-New bounds for keyed sponges with e","Park-2018-SpaceMint_ A Cryptocurrency Based on","Pass-2017-FruitChains_ A fair blockchain","Saleh-2007-Verifying security properties of cr","Schwartzbach-2021-An incentive-compatible smar","Spiegelman-2021-Game of coins","Tochner-2020-How to Pick Your Friends A Game T","Tötzer-2019-Blockchain as a game changer in en","Tsabary-2021-MAD-HTLC_ Because HTLC is crazy-c","Ventre-2008-Completely non-malleable encryptio","Xu-2021-A game-theoretic analysis of cross-cha","Yasuda-2012-PMAC with parity_ Minimizing the q"
