Topic,Article_Name
1,Besancon-2022-A Blockchain Ontology for DApps,El-Dosuky-2019-DOORchain_ Deep Ontology-Based,Huh-2019-XR collaboration architecture based o,Liu-2017-Quantum security analysis of a lattic,Liu-2022-Ready Raider One_ Exploring the Misus,Miranda-2022-Quantum Brain Networks_ A Perspec,Parikh-2019-GaN Power Commercialization with H,Quiles Pérez-2021-Breaching Subjects' Thoughts,Ruan-2021-Catfish Effect Between Selfish Miner,Shashikiran-2021-Minimal Block Knight’s Tour a,Xiaolin-2020-Combined output optimization base,Xiong-2022-Delay-Aware Cooperative Caching for
2,"21_Bauk","Adams-2018-A critical look at cryptogovernance","Agbo-2021-Scientific production and thematic b","Agmon-2022-Distributed Ledger Technology (DLT)","Ahmed-2022-The Digital and Cyberspace Moderniz","Aini-2022-iLearning education based on gamific","Al Shehhi-2022-Using a Hybrid Approach of Game","Arnedo-Moreno-2022-Research opportunities in t","Avyukt-2021-A decentralized review system for","Bauer-2020-Is there a market for trusted car d","Baur-2015-Cryptocurrencies as a disruption_ em","Bezerra-2022-Teaching software processes from","Blockchain_Technology_Exploring_Opportunities_","Bolsens-2020-Scalable system and silicon archi","Bucchiarone-2021-Guest Editorial Diversificati","Carlson-2019-Safe artificial general intellige","Carnevale-2020-Ethics and Decisions in Distrib","Centobelli-2022-Blockchain technology design i","Chao-2022-The Study of DeFi in Virtual Communi","Chen-2020-A brief introduction to blockchain e","Corrales Compag-2020-Legal Aspects of Decentra","Cu-2021-Blockchain-Based Governance in Fractio","De Boeck-2023-Data, analytical techniques and","De Villiers-2020-A Three-Tier Framework for Un","Dettling-2020-Bloxxgame – A Simulation Game fo","Dhewanto-2022-Towards Policy Development of En","Dos Santos-2019-Blockchain_ Status-quo, enable","Duh-2019-Publish-and-flourish_ Using blockchai","Dutta-2020-Blockchain vs GDPR in Collaborative","Espina-Romero-2022-What Are the Topics That Bu","Filippova-2019-Empirical evidence and economic","Gamal-2022-Challenges and Opportunities of Blo","Gao-2021-An empirical study on the adoption of","Gleim-2021-Blockchain_ a game changer for mark","Hickman-2020-Data sharing_ using blockchain an","Hong-2022-A Study on Corporate Information Ass","Hossain-2022-Cyber Threats and Scams in FinTec","Huang-2020-Fair and Protected Profit Sharing f","Huang-2023-Profit Sharing for Data Producer an","Jain-2020-Blockchain in logistics industry_ in","Jha-2023-COVID-19 Triggers a Paradigm Shift in","Kanchanaratanak-2022-Opportunities and Barrier","Kapsammer-2017-IVOLUNTEER - A digital ecosyste","Kera-2020-Anticipatory policy as a design chal","Kiayias-2020-A puff of steem_ Security analysi","Kim-2019-New blockchain adoptation for automot","Kim-2021-Adding Interactivity to Education of","Kolesnikov-2020-Efficient and secure logistics","Kurkin-2021-Corporate Database Management on t","Lara-2020-Special issue on the current trends","Li-2018-CAPTCHA_ Machine or human solvers_ a g","Liu-2019-Distributed K-Anonymity Location Priv","Lotfi-2022-Resource-constrained time–cost-qual","Mishra-2020-Prospero’s Books_ A Distributed Ar","Moradi-2018-MetaSyCar_ A System for Metabolic","Nabeeh-2022-Evaluation of Production of Digita","Naderi-2022-Leveraging Blockchain Technology a","Nguyen-2022-SoChainDB_ A Database for Storing","Nugraha-2021-Improving multi-sport event ticke","Ozpinar-2023-A Hyper-Integrated Mobility as a","Paajala-2022-Users’ Perceptions of Key Blockch","Pan-2021-Incentive Mechanism Design for Distri","Panachev-2021-Application of blockchain techno","Parizi-2018-On the understanding of gamificati","Puglisi-2022-Evolving Regulatory Frameworks_ B","Qiang-2021-Block chain algorithm rationality o","Raghav-2022-Reimaging Indian Healthcare using","Rahrouh-2022-The Potential Application of NFT","Razmjooei-2023-Industry 4.0 research in the ma","Saeidnia-2023-Non-fungible tokens (NFT)_ a saf","Saltykov-2018-Theory Game as Priority Area of","Sampath-2020-Spot collaborative shipping sans","Saritha-2021-Integration of Artificial Intelli","Seneviratne-2022-Blockchain for Social Good_ C","Serna Gómez-2021-Advances, Opportunities, and","Shah-2021-A Framework for Designing Self-susta","Shaheen-2021-A track donation system using blo","Sifah-2020-BEMPAS_ A Decentralized Employee Pe","Stepanyan-2022-Neuroeconomic Modeling of Distr","Stifter-2019-Avoiding Risky Designs When Using","Su-2021-Visualizing sustainable supply chain m","Suvajdzic-2020-Discover DaVinci - A Gamified B","Ten-2022-Engineering Blockchain Enabling Win A","Terzi-2022-A Life-Long Learning Education Pass","Thomas-2022-Gallery Defender_ Integration of B","Trovò-2021-Ants-Review_ A Privacy-Oriented Pro","Tuomas Harviain-2022-Cryptogames as Drivers fo","Uushona-2021-Network Forensics in a BYOD Envir","Veeningen-2018-Using serious gaming to discove","Veuger-2018-Trust in a viable real estate econ","Voicu-Dorobantu-2021-Using Blockchain for Opti","Wan-2022-Evolutionary game study on the govern","Webster-2018-Sharing is Caring_ Collaborative","Wernbacher-2022-HotCity—A Gamified Token Syste","Xiong-2021-Security and Privacy in Mobile Crow","Yang-2023-Non-Fungible Token (NFT) Games_ A Li","Yau-2022-Powering Financial Literacy Through B","Yfantis-2022-Using Gamification to Address the","Zeng-2022-WANA Wallet_ The Application Design","Zheng-2019-FinBrain_ when finance meets AI 2.0","Zhu-2020-Pricing strategy and system performan"
3,"1912.06412","Aponte-Novoa-2021-The 51% Attack on Blockchain","Arenas-2020-Cryptocurrency mining games with e","Benaddi-2021-Securing IoT Transactions Against","Bhattacherjee-2023-Voting Games to Model Proto","Breiki-2022-Trust Evolution Game in Blockchain","Cao-2019-Application of ZD strategy in mining","Chang-2019-Uncle-block attack_ Blockchain mini","Chang-2020-Dynamic power control for rational","Chatterjee-2018-Ergodic mean-payo games for th","Chen-2020-Decentralized mining pool games in b","Chen-2021-Evolutionary Equilibrium Analysis fo","Chen-2021-Impact of Temporary Fork on the Evol","Chen-2022-Toward Prevention of Parasite Chain","Cheng-2018-A hashing power allocation game in","Cheng-2019-Mining strategies for completing th","Cheng-2021-A hashing power allocation game wit","Cheng-2021-The evolutionary equilibrium of blo","Dey-2019-Securing Majority-Attack in Blockchai","Di-2019-The Consensus Games for Consensus Econ","Di-2020-The Framework of Consensus Equilibria","Du-2019-A biform game approach to preventing b","Elliott-2019-Nash Equilibrium of Multiple, Non","Ferreira-2021-Proof-of-Stake Mining Games with","Fujita-2020-Mining Pool Selection Problem in t","Fujita-2021-Mining pool selection under block","Giraldo-2020-Electronic Voting Using Blockchai","Goren-2019-Mind the mining","Hu-2019-A game theoretic analysis on block wit","Ilie-2021-Unstable throughput_ When the diffic","Jebari-2022-Analysis of Blockchain Selfish Min","Jeyasheela Rakk-2022-Comprehensive overview on","Jiang-2019-Bitcoin mining with transaction fee","Jiang-2021-On Game-theoretic Computation Power","Kaci-2020-PoolCoin_ Toward a distributed trust","Kaci-2020-Toward a Machine Learning and Softwa","Kiayias-2016-Blockchain mining games","Kim-2018-A Novel Bitcoin Mining Scheme Based o","Kim-2019-Mining Pool Manipulation in Blockchai","Koutsoupias-2019-Blockchain mining games with","Kraner-2022-Agent-based Modelling of Bitcoin C","Lamiri-2019-Bitcoin difficulty, a security fea","Leelavimolsilp-2019-Selfish Mining in Proof-of","Leonardos-2020-Oceanic Games_ Centralization R","Leva-2019-Control-oriented modelling of proof-","Li-2020-Mining Pool Game Model and Nash Equili","Li-2020-Rational Protocols and Attacks in Bloc","Li-2021-The Miner's Dilemma with Migration","Li-2022-The Miner&#x2019;s Dilemma With Migrat","Liu-2018-Evolutionary game for mining pool sel","Liu-2019-A Survey on Blockchain_ A Game Theore","Liu-2019-Decentralization is Vulnerable Under","Luu-2015-On Power Splitting Games in Distribut","Mirkin-2020-BDoS_ Blockchain Denial-of-Service","Nojoumian-2019-Incentivizing blockchain miners","Okada-2022-Sending Spies as Insurance Against","Ray-2018-A Mechanism Design Approach to Blockc","Samanta-2021-Quantified Analysis of Security I","Shanmuga Skandh-2022-Analysis of Cryptocurrenc","Shi-2021-Fee-Free Pooled Mining for Countering","Siomos-2019-Syriza's Populism_ Testing and Ext","Sun-2019-Moral hazard in games of miners (shor","Tang-2020-Cooperative Mining in Blockchain Net","Tang-2020-Incentivizing Honest Mining in Block","Toda-2021-Game-Theoretic Approach to a Decisio","Wang-2019-Pool strategies selection in pow-bas","Wang-2021-Game-Theoretical Analysis of Mining","Wang-2022-Arbitrage Attack_ Miners of the Worl","Wang-2022-Blockchain-based multi-malicious dou","Wang-2022-SDoS_ Selfish Mining-Based Denial-of","Wang-2023-Dissecting Mining Pools of Bitcoin N","Wen-2022-Exploration of Mined Block Temporaril","Xu-2019-MWPoW_ Multiple Winners Proof of Work","Xu-2020-Dynamic Selection of Mining Pool with","Yang-2020-IPBSM_ An optimal bribery selfish mi","Yao-2022-Equilibrium Analysis of Block Withhol","Yu-2020-Game Theoretic Analysis of Reputation","Yuan-2022-Edge mining resources allocation amo","Zhang-2021-Cooperation Mechanism in Blockchain","Zhang-2022-Insightful Mining Equilibria","Zheng-2019-New Game-Theoretic Analysis of DDoS","Zolotavkin-2019-Incentives for stable mining i","Zolotavkin-2019-Time-dependent decision-making"
4,"Bojinov-2014-Neuroscience meets cryptography_","Gaushik-2022-A Prototype Design for Gamified B","Ge-2021-A Privacy Protection Method of Lightwe","Gomez-2022-Watch Your Back_ Identifying Cyberc","Grillo-2022-Fashion and Metaverse_ an exposito","Guidi-2022-Sleepminting, the brand new frontie","Huang-2017-Behavior pattern clustering in bloc","Huang-2022-Temporal Analysis of Transaction Eg","Huang-2022-Who is gambling_ Finding cryptocurr","Jin-2022-Detecting Arbitrage on Ethereum Throu","Kanemura-2018-Design of privacy-preserving mob","Kerr-2018-How can legislators protect sport fr","Kirabo-2017-Neuregulin-1β induces proliferatio","Krasnoselskii-2023-KRAMER_ Interpretable Rarit","Lin-2019-An Evaluation of Bitcoin Address Clas","Liu-2021-Characterizing key agents in the cryp","Nadini-2021-Mapping the NFT revolution_ market","Phillips-2020-Tracing Cryptocurrency Scams_ Cl","Salau-2021-Data cooperatives for neighborhood","Sandaruwan-2020-Towards an Efficient and Secur","Saxena-2022-Integration of Back-Propagation Ne","Sun-2022-GAME-BC_ A Graph Attention Model for","Tasca-2018-The evolution of the bitcoin econom","Tekiner-2021-SoK_ Cryptojacking malware","Toyoda-2018-Multi-Class Bitcoin-Enabled Servic","Wang-2021-A MADM Location Privacy Protection M","White-2022-Characterizing the OpenSea NFT Mark","Wijayathilaka-2020-Secured, intelligent blood","Zhang-2020-Transaction community identificatio","Zheng-2022-Multimodal Learning for Improved NF","Zhou-2022-Behavior-Aware Account De-Anonymizat","Zhukov-2019-Fintech ecosystem the largest priv","Zola-2019-Bitcoin and cybersecurity_ Temporal","Zola-2020-Generative Adversarial Networks for"
5,"Adler-2018-Astraea_ A Decentralized Blockchain","Alefs-2022-Secure Decentralized Online Gaming","Arora-2022-Smart Contracts and NFTs_ Non-Fungi","Asgaonkar-2019-Solving the Buyer and Seller's","Bacis-2021-I Told You Tomorrow_ Practical Time","Badash-2021-Blockchain-based bug bounty framew","Beniiche-2021-Robonomics in the 6G Era_ Playin","Benini-2021-Power and Pitfalls of Generic Smar","Besancon-2019-Towards blockchain interoperabil","Boron-2021-Alternative authentication with sma","Chatterjee-2018-Quantitative analysis of smart","Chatterjee-2019-Probabilistic smart contracts_","Chen-2017-Decentralized execution of smart con","Chen-2019-Lottery dapp from multi-randomness e","Chen-2019-The game among bribers in a smart co","Chen-2020-A Survey on Ethereum Systems Securit","Chen-2022-A New NFT Model to Enhance Copyright","Chepurnoy-2019-Multi-stage Contracts in the UT","Danos-2021-Revisiting the liquidity_risk trade","Distefano-2020-MOATcoin_ Exploring challenges","Dookie-2020-Building an Inclusive Distributed","Driessen-2021-Validated Data Quality Assessmen","Eisele-2022-Decentralized Computation Market f","Ellul-2022-SoliNomic_ A Self-modifying Smart C","Finogeev-2018-Blockchain and smart contracts f","Fowler-2021-Tokenfication - The potential of n","Galal-2023-Aegis_ Privacy-Preserving Market fo","Gamidullaeva-2019-Smart contracts for multi-ag","Goharshady-2021-Irrationality, Extortion, or T","Gupta-2022-Integration of blockchain with emer","Gürsoy-2020-Using Ethereum blockchain to store","Hardwick-2018-E-Voting with Blockchain_ An E-V","Hari-2023-T-PASS_ A Blockchain-based NFT Enabl","Harkanson-2020-A Framework for Decentralized P","Harris-2019-Decentralized and collaborative AI","He-2020-Smart Contract Vulnerability Analysis","Hu-2020-Analyzing smart contract interactions","Ibba-2022-Analysis of the Relationship between","Ji-2021-Security Analysis of Blockchain Smart","Kalra-2018-Blockchain-based real-time cheat pr","Karapapas-2021-Fully Decentralized Trading Gam","Karapapas-2022-Decentralized NFT-based Evolvab","Kirillov-2022-Rental NFT Protocol With Advance","Kraft-2022-Horizontal Scalability of Blockchai","Latifi-2019-Blockchain-based real estate marke","Li-2019-Decentralized release of self-emerging","Li-2020-Dynamic Gas Estimation of Loops Using","Li-2020-Trace-Based Dynamic Gas Estimation of","Libin-2021-Agent-Oriented Modelling for Blockc","Liu-2020-Towards automated verification of sma","Lohr-2022-Formalizing Cost Fairness for Two-Pa","Lu-2022-Say No to Price Discrimination_ Decent","Lu-2022-_sc_iQuery__sc__ A Trustworthy and Sca","Lu-2023-Safety Warning! Decentralised and Auto","McCorry-2020-You Sank My Battleship! A Case St","Migliorini-2019-A Blockchain-based solution to","Migliorini-2019-The Rise of Enforceable Busine","Min-2019-A security case study for blockchain","Moore-2022-Fortuna_ A Novel Staked Voting Syst","Moti-2020-Orthos_ A Trustworthy AI Framework f","Nam-2022-Formal Verification of Blockchain Sma","Neiheiser-2020-HRM smart contracts on the bloc","Nelaturu-2020-On Public Crowdsource-Based Mech","Nikhil-2022-Instigating Decentralized Apps wit","Pan-2019-Building a blockchain simulation usin","Papathanasiou-2023-R_ddle_ A Fully Decentraliz","Pittaras-2021-Beacons and blockchains in the m","Posavec-2022-Non-Fungible Tokens_ Might Learni","Qiao-2020-Dynamic autonomous cross consortium","Ragnoni-2021-System and Methods for Blockchain","Sako-2021-Fairness in ERC Token Markets_ A Cas","Serada-2021-Vintage CryptoKitties and the Ques","Smith-2022-The Spectacular Collapse of Cryptok","Spoto-2022-On the use of generic types for sma","Sun-2022-Matrix World - A Programmable 3D Mult","Tang-2022-A Graph Neural Network-based Code Re","Tikhomirov-2018-Ethereum_ State of knowledge a","Trojanowska-2020-Secure Decentralized Applicat","Vairagade-2022-Proposal on NFT Minter for Bloc","Wu-2020-Group Activity Matching with Blockchai","Wu-2022-CCOM_ Cost-Efficient and Collusion-Res","Xia-2017-Enhanced TLS handshake authentication","Zhao-2019-Y-DWMS_ A digital watermark manageme","Zhou-2018-Trustworthy cloud service level agre","Zhou-2019-A Blockchain based Witness Model for","Zhou-2021-Enforcing trustworthy cloud SLA with","Zhu-2019-A proposal for account recovery in de","Zhu-2022-Making Smart Contract Classification"
6,"Barreiro-Gomez-2019-Blockchain token economics","Cai-2020-A Blockchain-Based Crowdsourcing Syst","Chen-2022-DIM-DS_ Dynamic Incentive Model for","Chuang-2020-TIDES_ A Trust-Aware IoT Data Econ","Feng-2018-Competitive Data Trading in Wireless","Fu-2023-A Survey of Blockchain and Intelligent","Guo-2022-Blockchain-based Reputation Evaluatio","Guo-2022-Labrador_ towards fair and auditable","Han-2022-A Two-layer Game-based Incentive Mech","He-2018-A Blockchain Based Truthful Incentive","Hu-2020-A Blockchain-Based Reward Mechanism fo","Hu-2022-BC-MCSDT_ A Blockchain-based Trusted M","Huang-2021-Privacy-Enhanced Crowdsourcing Data","Hui-2022-BCC_ Blockchain-Based Collaborative C","Islam-2022-Transparency-privacy Trade-off in B","Jia-2018-A blockchain-based location privacy p","Jiang-2022-IIoT Data Sharing Based on Blockcha","Khezr-2022-Towards a Trustful Game-Theoretic M","Li-2019-EdgeCare_ Leveraging Edge Computing fo","Li-2021-Healthchain_ Secure EMRs Management an","Liang-2022-GAIMMO_ A Grade-driven Auction-base","Liu-2019-Optimal Pricing Mechanism for Data Ma","Liyuan-2019-E2C-Chain_ A two-stage incentive e","Lou-2018-Research on the Cooperative Behavior","Lv-2020-Blockchain based spectrum sensing_ A g","Nguyen-2019-Enabling On-demand decentralized I","Nie-2022-Blockchain-Empowered Secure and Priva","Paul-2020-Smart Contract-Driven Mechanism Desi","Peng-2022-Blockchain-assisted D2D Data Sharing","Predescu-2021-A serious gaming approach for cr","Qi-2022-High-Quality Model Aggregation for Blo","Qi-2022-Security Evaluation Model of Blockchai","Qu-2021-Proof of Federated Learning_ A Novel E","Qu-2022-Future Research Directions","Rizwan-2021-SAID_ ECC-Based Secure Authenticat","Shi-2022-Threat Intelligence Sharing Model and","Sun-2022-A Novel Layered GSP Incentive Mechani","Tian-2022-Efficient Mobile Vehicle Data Sharin","Toyoda-2019-Mechanism Design for An Incentive-","Wang-2021-DCrowd_ A Decentralized Service Mode","Wang-2022-BSIF_ Blockchain-Based Secure, Inter","Wei-2021-A Modified Blockchain DPoS Consensus","Weng-2021-FedServing_ A federated prediction s","Wu-2018-Design of Evaluation System for Digita","Wu-2020-Game theory for mobile location privac","Xin-2020-Reciprocal crowdsourcing_ Building co","Xu-2019-A blockchain-enabled trustless crowd-i","Xu-2020-Improving the Efficiency of Blockchain","Xu-2021-URIM_ Utility-Oriented Role-Centric In","Xu-2022-A Survey of Blockchain-Based Crowd Sen","Xu-2023-IDADET_ Iterative Double-sided Auction","Yang-2021-PMAB_ A Public Mutual Audit Blockcha","Ye-2021-A Recommendation Scheme with Reputatio","Yin-2021-A Blockchain-Based Storage System wit","Zhai-2022-Research on the Storage and Sharing","Zhang-2019-VeSenChain_ Leveraging consortium b","Zhang-2020-Game-theoretic Modeling and Stabili","Zhang-2021-A Transaction Transmission Model fo","Zhou-2021-Data Trading for Blockchain-Based Da","Zhu-2019-An Incentive Mechanism Using Shapley","Zou-2021-Reputation-based regional federated l"
7,10.3934%2Fjimo.2020049,Alghabashi-2018-A finite multi-dimensional gen,Chen-2022-TIPS_ Transaction Inclusion Protocol,Daian-2020-Flash boys 2.0_ Frontrunning in dec,Heimbach-2022-Eliminating Sandwich Attacks wit,Hu-2020-A Correlated Equilibrium based Transac,Kruminis-2022-Game-Theoretic Analysis of an Ex,Li-2018-Blockchain queue theory,Li-2018-Transaction Queuing Game in Bitcoin Bl,Li-2019-Bitcoin Fee Decisions in Transaction C,Li-2022-A Novel GSP Auction Mechanism for Dyna,Li-2022-Analyzing Bitcoin transaction fees usi,Liu-2020-Economics of Blockchain Storage,Liu-2022-A Storage Sustainability Mechanism Wi,Liu-2022-An Incentive Mechanism for Sustainabl,McCorry-2017-Atomically trading with roger_ Ga,Qi-2020-Nash Equilibrium and Social Optimizati,Riehl-2020-Transaction Pricing for Maximizing,Torky-2022-Scheduling and Securing Drone Charg,Yan-2020-Dynamic Game Model for Ranking Bitcoi,Zhou-2021-High-frequency trading on decentrali
8,Biström-2015-Taxonomic revision of afrotropica
9,Agrawal-2017-Stronger security for reusable ga,Agrawal-2020-Adaptive Simulation Security for,Anderson-2006-Cryptographic processors - A sur,Balli-2020-Determining the Core Primitive for,Budiman-2020-A Crypto Compression System Using,Cambou-2020-Securing additive manufacturing wi,Chatzigiannis-2022-Homomorphic Decryption in B,Chen-2020-Application of Homomorphic Encryptio,Chen-2021-An incentive-compatible rational sec,Chen-2022-Searching for Encrypted Data on Bloc,Chhatrapati-2022-A Performance Evaluation of P,Du-2022-Enhancing Cryptocurrency Blocklisting_,Egozcue-2002-Diploid sperm and the origin of t,Ehara-2019-How to generate transparent random,Frankel-1995-Cryptanalysis of the immunized LL,Gama-2007-New chosen-ciphertext attacks on NTR,Gamage-2000-High performance agile crypto modu,Glaeser-2022-Foundations of Coin Mixing Servic,Großschädl-2000-High-Speed RSA hardware based,Guan-2022-Fair Outsourcing Polynomial Computat,Huang-2023-Blockchain-Assisted Personalized Ca,Hussein-2006-Randomized cryptosystems attacks,Jia-2019-DeLottery_ A novel decentralized lott,Kanth-2022-Blockchain-based Authenticated Steg,Li-2019-BanFEL_ A Blockchain Based Smart Contr,Lin-2018-An ID-Based Linearly Homomorphic Sign,Liu-2020-Game Theoretic Approach for Secure an,Luong-2023-Privacy-Preserving Identity Managem,Mittelbach-2013-Cryptophia's short combiner fo,Oh-2022-A Secure Personal Health Record Sharin,Paşca-2018-Challenges in cyber security_ Ranso,Patel-2021-Blockchain-Envisioned Trusted Rando,Qiu-2022-Fine-grained Access Control Method fo,Sadkhan-2019-Best Strategies of Choosing Crypt,Sadkhan-2019-Hybrid Strategies for Choosing Su,Sahai-2011-Fully secure accountable-authority,Sahitya-2021-D-Lotto_ The Lottery DApp with Ve,Sako-2022-Distributed Random Number Generation,Seo-2022-Reminisce_ Blockchain Private Key Gen,Sepehri-2017-Efficient implementation of a pro,Simic-2020-A review on generating random numbe,Simmons-1985-The subliminal channel and digita,Stengele-2018-Atomic Information Disclosure of,Tomaz-2022-Blockchain-based whistleblowing ser,Valli Kumari-2010-Secure group key distributio,Wei-2016-Simple and fast identity-based encryp,Wu-2018-Fair electronic voting via bitcoin dep,Xiao-2021-Secure and Efficient Multi-Signature,Xu-2021-Chosen-Ciphertext Secure Key Encapsula,Yang-2018-Decentralized blacklistable anonymou,Yuan-2013-Public key timed-release searchable,Zhang-2014-A new multivariate based threshold,Zhu-2022-Traceable Scheme of Public Key Encryp
10,"Alzahrani-2018-Towards true decentralization_","Alzahrani-2020-A new product anti-counterfeiti","Aruna-2020-Highly secured blockchain based ele","Asheralieva-2020-Reputation-Based Coalition Fo","Avarikioti-2019-Payment Networks as Creation G","Avarikioti-2020-Ride the Lightning_ The Game T","Bai-2022-Public Participation Consortium Block","Bai-2022-Understanding the Benefit of Being Pa","Ballard-2020-Blockchain_ The facts and fiction","Barhanpure-2019-Proof of stack consensus for b","Bhudia-2022-Extortion of a Staking Pool in a P","Boreiri-2022-A Novel Consensus Protocol in Blo","Borse-2022-A Review of Blockchain Consensus Al","Chen-2021-User distributions in shard-based bl","Christodoulou-2020-Consensus crash testing_ Ex","Di Stefano-2020-Resolution of Blockchain Confl","Fooladgar-2020-On Incentive Compatible Role-Ba","Gamage-2020-A Survey on Blockchain Technology","Gupta-2019-Colosseum_ A scalable permissioned","Hemati-2021-An incentive compatible reward sha","Huang-2020-Incentive Assignment in PoW and PoS","Huang-2021-Do the Rich Get Richer_ Fairness An","Jain-2022-Tiramisu_ Layering Consensus Protoco","Jiang-2022-GaS-PBFT_ A Game-based Node Selecti","Kano-2017-A new approach to mining work in blo","Kara-2021-A compute and wait in pow (Cw-pow) c","Kim-2019-Two-phase cooperative bargaining game","Kumar-2020-Proof of Game (PoG)_ A game theory","Kumar-2021-Proof of Game (PoG)_ A Proof of Wor","Lee-2020-Proof-of-stake at stake_ Predatory, d","Manshaei-2018-A Game-Theoretic Analysis of Sha","Nguyen-2019-Proof-of-Stake Consensus Mechanism","Nguyen-2021-Blockchain-based Secure platform f","Nguyen-2022-BlockRoam_ Blockchain-Based Roamin","Nguyen-2023-FedChain_ Secure Proof-of-Stake-ba","Ni-2019-Evolutionary Game for Consensus Provis","Okanami-2020-Load balancing for sharded blockc","Okanami-2022-Load Balancing with In-Protocol_W","Pickhardt-2020-Imbalance measure and proactive","Potop-Butucaru-2021-Blockchains and the Common","Qi-2022-Collusion Attack Analysis and Detectio","Quan-2021-Intra-Shard and Inter-Shard Collabor","Rana-2022-Free2Shard_ Adversary-resistant Dist","Sai-2019-Disincentivizing double spend attacks","Sel-2018-Towards solving the data availability","Swathi-2021-An analysis on blockchain consensu","Tao-2020-On sharding open blockchains with sma","Thakur-2020-Collusion Attack from Hubs in The","Tyagi-2022-Game Theory-Based Proof of Stake Mi","Uz Zaman-2020-Decentrally-consented-server-bas","Wang-2019-A Survey on Consensus Mechanisms and","Wang-2022-A Blockchain Consensus Protocol Base","Wang-2022-PoTA_ A hybrid consensus protocol to","Wen-2022-Optimal Block Propagation and Incenti","Wu-2022-Committee Selection Based on Game Theo","Yang-2022-User-Centric Blockchain for Industry","Yun-2019-MMOG user participation based decentr","Zappalà-2020-Brief announcement_ Game theoreti","Zhang-2023-Transaction transmission model for"
11,Asheralieva-2021-Bayesian Reinforcement Learni,Feng-2019-Dynamic Sensor Renting in RF-powered,Han-2019-Blockchain Based Spectrum Sharing Alg,Khalid-2021-A Secure Trust Method for Multi-Ag,Li-2023-Multi-Operator Dynamic Spectrum Sharin,Liu-2020-Efficient QoS Support for Robust Reso,Niu-2021-Impacts of Managerial Overconfidence,Xin-2020-Stability and Hopf Bifurcation of a S,Zheng-2022-Cooperative Spectrum Sensing and Fu,Zhou-2022-Blockchain-based Stackelberg Game Op
