Topic,Article_Name
12,"10.3934%2Fjimo.2022087","Adamashvili-2021-Blockchain-based wine supply","Behl-2022-Assessing retailer readiness to use","Brache-2021-Relational Capital and Blockchain_","Cao-2022-Evolutionary Game of Supply Chain All","Cao-2022-Optimal Operation Policies in a Cross","Cheng-2021-Traceability Management Strategy of","Cheng-2023-Incentive-Driven Information Sharin","Ding-2022-Optimal Decision and Coordination of","Ding-2023-Blockchain Adoption among Multi-Stak","Fosso Wamba-2019-Continuance intention in bloc","Guo-2021-Optimized Combination of e-commerce P","Guo-2022-Supply Chain Governance of Agricultur","Guo-2022-The Marketing of Cross-border E-comme","Guo-2023-Applications of Blockchain Technology","Hayrutdinov-2020-Coordination of Supply Chain","Hellwig-2022-Playing with DISASTER_ A Blockcha","Hrušovský-2022-Battling the Bullwhip Effect wi","Hu-2021-Blockchain or not_ Optimal decisions f","Huo-2022-Evolutionary Game Analysis of Standar","Jiang-2022-Research on carbon emission reducti","Ko-2018-Blockchain technology and manufacturin","Ko-2023-Supply chain transparency as a signal","Kong-2020-Game Studies on Accounting Entity Be","Li-2022-Research on Green Supply Chain Decisio","Liao-2022-Governmental Anti-Pandemic and Subsi","Liu-2021-Evolutionary game analysis of Chinese","Liu-2021-Pricing and coordination of vaccine s","Liu-2021-Supply Chain Decision Model Based on","Liu-2022-The provision strategy of blockchain","Lotfi-2021-Viable Supply Chain Network Design","Lotfi-2022-Viable supply chain with vendor-man","Luo-2022-Comparative Research on the Game Beha","Luo-2022-E-commerce supply chains with conside","Luo-2022-Information Sharing Game and Value An","Ma-2022-Research on optimization of food suppl","Manzoor-2022-Blockchain technology in supply c","Pranesh-2020-Design and Analysis of Incentive","Shan-2021-Research on Collaborative Governance","Sodamin-2022-Fair Label versus Blockchain Tech","Song-2022-Blockchain Adoption in Agricultural","Song-2022-Blockchain’s role in e-commerce sell","Song-2023-Impact of Government Subsidies, Comp","Su-2022-Blockchain-Driven Optimal Strategies f","Sun-2021-Evolutionary game analysis of blockch","Sun-2021-Mechanism analysis of applying blockc","Sun-2023-Strategy Analysis of Fresh Agricultur","Tan-2022-The Safe Financial Processing Method","Violino-2019-Are the innovative electronic lab","Wang-2020-A Secure and Credible Supply Chain S","Wang-2021-Application of blockchain technology","Wang-2022-Recycling Model Selection for Electr","Wu-2023-Platform-leading blockchain adoption f","Xiaocong-2021-Optimization of biomass collecti","Xie-2022-Research on Evolutionary Game of Supp","Xie-2022-Study on Enterprise Financial Risk Pr","Xin-2022-Incentive and Game of Information Sha","Xu-2022-Differential Game Model of Information","Xu-2023-What influences stakeholders' decision","Yang-2022-BLOCKCHAIN-BASED COLLABORATIVE MANAG","Yang-2022-Decisions for Blockchain Adoption an","Ye-2022-Early Adopter or Follower&#x003F; The","Yin-2021-Research on Resource Carbon Emission","Yu-2023-Evolutionary Game of Digital-Driven Ph","Zhang-2022-Optimal Pricing Decisions for Dual-","Zhang-2023-Multi-Party Evolutionary Game Analy","Zhao-2022-Evolutionary Game and Simulation Res","Zhao-2022-Evolutionary game of banks and enter","Zheng-2022-Blockchain-based intelligent contra","Zheng-2022-Supply chain quality level decision","Zheng-2023-Blockchain Traceability Adoption in","Zhou-2021-Game Analysis of _Blockchain+Supply","Zhou-2022-Information Disclosure Decision for","Zhu-2023-Three-Party Stochastic Evolutionary G"
13,"Abegaz-2023-Blockchain-Based Resource Trading","Asheralieva-2020-Distributed Dynamic Resource","Asheralieva-2021-Learning-Based Mobile Edge Co","Baek-2020-Privacy-preserving and trustworthy d","Bai-2022-Trustworthy Blockchain-Empowered Coll","Bataineh-2020-A game-based secure trading of b","Cao-2022-Credible and economic multimedia serv","Cao-2023-Blockchain Systems, Technologies, and","Chai-2019-Proof-of-Reputation Based-Consortium","Chang-2020-Incentive Mechanism for Edge-Comput","Chang-2021-Blockchain-Empowered Drone Networks","Chen-2019-Cooperative and Distributed Computat","Chen-2022-Internet of Vehicles Resource Schedu","Chen-2022-Joint pricing and task allocation fo","Cheng-2022-SBA-GT_ A Secure Bandwidth Allocati","Ding-2021-An Incentive Mechanism for Building","Ding-2022-Pricing and Budget Allocation for Io","Du-2020-Optimal Computation Resource Allocatio","Erfan-2022-Game-theoretic Designs for Blockcha","Fan-2020-Stackelberg game based edge computing","Fan-2021-Cloud_Edge Computing Resource Allocat","Fan-2021-Three-stage Stackelberg game based ed","Fan-2022-Mobile Devices Strategies in Blockcha","Fang-2021-Joint Distributed Cache and Power Co","Feng-2021-On Cyber Risk Management of Blockcha","Fu-2020-Integrated Resource Management for Ter","Fu-2023-Game model of optimal quality experien","Gao-2019-Blockchain enabled distributed cooper","Guo-2020-Blockchain Meets Edge Computing_ Stac","Guo-2020-Edge Network Resource Synergy for Mob","Guo-2020-Resource allocation for edge computin","Guo-2021-Enabling Massive IoT Toward 6G_ A Com","Guo-2021-Incentive Mechanism Design for Blockc","Guo-2022-Incentive Mechanism for Edge Computin","Hassija-2020-A Blockchain based Framework for","Hassija-2020-A blockchain-based framework for","Hassija-2021-A mobile data offloading framewor","Hu-2020-An Evolutionary Game Assisted Spectrum","Hu-2021-Securing SDN-Controlled IoT Networks t","Hu-2022-Leveraging Blockchain for Multi-Operat","Huang-2020-Securing parked vehicle assisted fo","Huang-2021-Blockchain-Enabled Task Offloading","Huang-2021-Stackelberg Game Based Resource Pri","Huang-2022-Edge Resource Pricing and Schedulin","Islam-2021-Blockchain-Enabled Intelligent Vehi","Jameel-2021-Efficient Mining Cluster Selection","Jiang-2019-Hierarchical edge-cloud computing f","Jiang-2020-A game-theoretic approach to storag","Jiang-2020-Game theoretic storage outsourcing","Jiang-2022-Multi-Leader Multi-Follower Stackel","Jiang-2023-Reliable Distributed Computing for","Jiao-2019-Auction mechanisms in cloud_fog comp","Jing-2023-Joint resource trading and computati","Khan-2022-A Survey on Mobile Edge Computing fo","Lang-2022-Cooperative Computation Offloading i","Lei-2022-GBRM_ a graph embedding and blockchai","Li-2019-DQN for Multi-layer Game Based Mining","Li-2021-NOMA-Enabled Cooperative Computation O","Li-2022-Edge Blockchain Construction Efficienc","Liang-2022-Resource Competition in Blockchain","Liao-2021-Information-centric massive iot-base","Lin-2021-Blockchain-Based On-Demand Computing","Lin-2022-Blockchain-Based Incentive Energy-Kno","Liu-2018-Resource Allocation for Video Transco","Liu-2019-Decentralized Resource Allocation for","Liu-2020-A Distributed Game Theoretic Approach","Liu-2022-Blockchain Based Offloading Strategy_","Mai-2023-Cloud Mining Pool Aided Blockchain-En","Maksymyuk-2019-Blockchain-based intelligent ne","Nguyen-2020-Blockchain and Stackelberg Game Mo","Nguyen-2022-MetaChain_ A Novel Blockchain-base","Nguyen-2023-Cooperative Task Offloading and Bl","Qiu-2019-Online deep reinforcement learning fo","Qiu-2020-Blockchain-Based Secure Spectrum Trad","Ramneek-2022-A Lightweight and Secure Vehicula","Ren-2022-AI-Bazaar_ A Cloud-Edge Computing Pow","Seid-2022-Blockchain-Enabled Task Offloading W","Seid-2023-Blockchain-Empowered Resource Alloca","Seng-2021-User Matching on Blockchain for Comp","Shao-2021-On Strategic Interactions in Blockch","Su-2021-A Cooperative Game Theory and Blockcha","Sun-2022-Against Colluding Mining with Reward","Sun-2022-Joint Mining Offloading and Computing","Taghavi-2018-Cloudchain_ A blockchain-based co","Taghavi-2020-A Blockchain-Based Model for Clou","Tang-2022-Incentivizing Proof-of-Stake Blockch","Venkateswararar-2022-BandBlock_ Bandwidth allo","Wadhwa-2022-Optimal Resource Allocation by Rev","Wang-2019-Blockchain-based resource allocation","Wang-2022-A Game for Task Offloading in Reputa","Wang-2022-InFEDge_ A Blockchain-Based Incentiv","Wang-2022-Mean-Field Learning for Edge Computi","Wei-2020-Block Mining or Service Providing_ A","Wilczynski-2021-Security aspects in blockchain","Wilczyński-2022-Blockchain-Based Task and Info","Wu-2018-Optimal computational power allocation","Wu-2020-An Effective Resource Allocation Appro","Wu-2020-Revenue-sharing based computation-reso","Wu-2021-Enhanced Game Theoretical Spectrum Sha","Xi-2019-Perishable digital goods trading mecha","Xiao-2022-Consortium Blockchain-Based Computat","Xie-2021-Secure Data Sharing in UAV-assisted C","Xing-2022-UAVs Assisted Secure Blockchain Offl","Xing-2022-UAVs-Aided Delay-Tolerant Blockchain","Xiong-2018-Optimal pricing-based edge computin","Xiong-2019-Cloud_fog computing resource manage","Xiong-2020-Cloud_Edge Computing Service Manage","Xu-2018-Game theoretic study on blockchain bas","Xu-2021-Edge Computing Resource Allocation for","Yacob-2022-An Optimal Incentive Mechanism for","Yang-2022-Joint Optimization of Edge Computing","Yang-2022-Reputation Mechanism Designed for Bl","Yang-2022-Two-Level Stackelberg Game for IoT C","Yao-2019-Resource trading in blockchain-based","Zhang-2018-Energy-Aware Task Offloading for Ul","Zhang-2019-Joint Computation Offloading and Co","Zhang-2019-Mining task offloading in mobile ed","Zhang-2021-Resource sharing of mobile edge com","Zhang-2022-A Blockchain Enhanced Coexistence o","Zhang-2022-Computing Resources Sharing Network","Zhang-2022-Economic Analysis of Decentralized","Zhao-2019-Coalition Game-Based Computation Res","Zhao-2020-A robust incentive consensus propaga","Zheng-2020-Blockchain-Based Vehicular Collabor","Zuo-2020-Computation Resource Allocation in Mo","Zuo-2021-Blockchain Storage and Computation Of","Zuo-2021-Computation Offloading in Untrusted M","Zuo-2021-Delay-Limited Computation Offloading"
14,1903.11172,Akgul-2022-Blockchain-based Cryptocurrency Pri,Biais-2019-The Blockchain Folk Theorem,Du-2019-Anlysis and design of activity degree,Hu-2020-Sync or Fork_ Node-Level Synchronizati,Kim-2021-Enhanced IoV security network by usin,Kovacs-2021-A collaborative game theory approa,Liao-2022-A Federated Blockchain Approach for,Makiyama-1965-On some problems concerning the,Mou-2021-Game-Theoretic Analysis on CBDC Adopt,Ovezik-2022-Decentralization Analysis of Pooli,Proskuryakov-2021-Predictive-Free Methods for,Ramamurthy-1992-High-Performance Liquid Chroma,Tsabary-2018-The gap game,Zhang-2020-On modeling blockchain-enabled econ,Zhao-2022-Research on Information Propagation
15,"Abishu-2022-Consensus Mechanism for Blockchain","Afzal-2020-Blockchain enabled distributed dema","Aggarwal-2022-PETS_ P2P Energy Trading Schedul","Ali-2020-Efficient and Secure Energy Trading i","Barnawi-2023-Path Planning for Energy Manageme","Bhattacharya-2022-EVBlocks_ A Blockchain-Based","Bhattacharya-2022-Incentive Mechanisms for Sma","Cao-2021-A Multi-Agent Reinforcement Learning","Chau-2019-Peer-to-peer energy sharing_ Effecti","Chen-2019-Secure Electricity Trading and Incen","Chen-2020-Loaning Decision for Electric Vehicl","Chen-2021-Distributed Power Trading System Bas","Cui-2020-Prosumer community_ A risk aversion e","Damisa-2022-Blockchain-Based Gas Auctioning Co","Das-2022-A Review of Challenges and Solution i","Djehiche-2019-Mean-field-type games for blockc","Doan-2021-Peer-to-peer energy trading in smart","Döbelt-2020-Peer-to-Peer Traded Energy_ Prosum","Edussuriya-2023-Peer-to-Peer Energy Trading th","Ferreira-2018-Building a community of users fo","Fu-2019-Research on micro-grid group intellige","Fu-2020-Research on Block-Chain-Based Intellig","Ghosh-2019-Strategic Prosumers_ How to Set the","Guo-2020-Blockchain-enabled demand response sc","Guo-2021-A Blockchain-Enabled Ecosystem for Di","Guo-2022-An Architecture for Distributed Energ","Hassan-2020-DEAL_ Differentially Private Aucti","Hassija-2019-BlockCom_ A blockchain based comm","Hassija-2020-A Blockchain-Based Framework for 3","Hassija-2020-A blockchain-based framework for 2","He-2022-Combined game model and investment dec","Hu-2022-Research on Multimicrogrid Transaction","Hua-2023-Blockchain Enabled Decentralized Loca","Huang-2023-Blockchain-enabled Carbon and Energ","Jayaprakash-2021-A systematic review of energy","Ji-2022-Selection Game for Consensus-Based Dec","Kajaan-2021-Review of Market Clearing Method f","Kakkar-2022-Blockchain and IoT-Driven Optimize","Kakkar-2022-Blockchain and Zero-Sum Game-based","Krayem-2023-A game-theoretic approach to asses","Li-2018-Consortium blockchain for secure energ","Li-2019-A Blockchain-based Distributed Non-coo","Li-2019-Decentralized On-Demand Energy Supply","Li-2021-Blockchain-based Dynamic Game of Elect","Li-2021-Electric Vehicle Peer-to-Peer Energy T","Li-2021-Security Transaction Mechanism of Ener","Li-2022-Research on key technologies of P2P tr","Liang-2022-V2GNet_ Robust Blockchain-Based Ene","Liu-2020-Microgrid Trading Game Model Based on","Liu-2020-Multi-party energy management of ener","Liu-2021-Electricity market transaction model","Liu-2023-Blockchain-Based Renewable Energy Tra","Luo-2022-Blockchain-Enabled Two-Way Auction Me","Makhsoos-2022-Designing a High Performance and","Morstyn-2019-Designing decentralized markets f","Okoye-2022-Adopting the Game Theory Approach i","Ouyang-2021-Research on new energy trading sys","Sabounchi-2017-Towards resilient networked mic","Sabounchi-2018-A Decentralized P2P Electricity","Said-2021-A Decentralized Electricity Trading","Samadi-2021-Energy Blockchain for Demand Respo","Samuel-2020-Leveraging blockchain technology f","Saukh-2018-Synchronization Games in P2P Energy","Stephant-2020-Increasing Photovoltaic Self-con","Stephant-2021-Increasing photovoltaic self-con","Tian-2022-Design of Joint Trading Platform for","Tsaousoglou-2020-Truthful, Practical and Priva","Tushar-2020-Peer-to-Peer Trading in Electricit","Wang-2019-A secure private charging pile shari","Wang-2022-A Secure and Efficient Wireless Char","Wang-2022-Blockchain-Based Intelligent Interco","Wang-2022-Blockchain-Based Secure and Cooperat","Wu-2018-Game mechanism design of smart contrac","Xia-2020-A Bayesian Game Based Vehicle-to-Vehi","Xu-2019-Microgrid group trading model and solv","Xue-2022-Research on cooperation strategy betw","Yan-2021-Blockchain for Transacting Energy and","Yang-2020-Automated Demand Response Framework","Yang-2021-Design of Double-chain Blockchain Ar","Yang-2022-Hierarchical Blockchain Design for D","Yu-2018-Design and implementation of a blockch","Yuan-2022-Study on Game Behavior of Power Supp","Yun-2021-Residential energy trading with block","Zade-2022-Evaluating the added value of blockc","Zhang-2020-High-quality extraction method of e","Zhang-2022-Demand-Response Games for Peer-to-P","Zhang-2023-Local power consumption method of d","Zhao-2019-Consortium blockchain-based microgri","Zhao-2022-A Secure Intra-Regional-Inter-Region","Zhou-2018-Blockchain and Edge Computing Based","Zhou-2020-Blockchain Based Potential Game Mode","Zhou-2020-Secure and Efficient Vehicle-to-Grid","Zhou-2022-Energy Block Chain Trading Mechanism"
16,"Aizawa-2016-Invariant partial differential equ","Amir Latif-2019-Blockchain Transforms the Reta","Armani-2019-Seamless Grid_ An off-chain model","Boateng-2022-Blockchain-Enabled Resource Tradi","Boateng-2022-Consortium Blockchain-Based Spect","Choi-2019-Game theoretical approach of blockch","Du-2022-Blockchain-Aided Edge Computing Market","Faical-2023-A Cyber-Physical System&#x0027;s R","Fernando-2020-Blockchain-based Wi-Fi offloadin","Fournaris-2008-Creating an Elliptic Curve arit","Gheitanchi-2020-Gamified service exchange plat","He-2022-NetChain_ A Blockchain-Enabled Privacy","He-2023-Blockchain-Based P2P Content Delivery","Hewa-2022-Demo_ Blockchain-based Secured and F","Hewa-2023-Blockchain and Game Theory Convergen","Hewa-2023-Blockchain-Based Network Slice Broke","Hu-2020-Blockchain-Aided Flow Insertion and Ve","Huang-2019-Implementing an asset trading syste","Jin-2018-Evolutionary game analysis on permiss","Karakus-2021-QoSChain_ Provisioning Inter-AS Q","Kwantwi-2023-Blockchain-Based Computing Resour","Laih-1989-A new scheme for ID-based cryptosyst","Liao-2020-Proof-of-balance_ Game-theoretic con","Mondal-2020-BIND_ Blockchain-based flow-table","Musamih-2022-NFTs in Smart Cities_ Vision, App","Pu-2020-Blockchain adoption time of shipowners","Shao-2019-Blockchain-Based SDN Security Guaran","Singh-2018-Blockchain_ A game changer for secu","Suo-2023-Proof of Travel for Trust-Based Data","Vakilinia-2023-An Incentive-Compatible Mechani","Wang-2018-Decentralized Caching for Content De","Wang-2020-Game Strategy of Environmental Regul","Wang-2022-A Platform-Free Proof of Federated L","Wang-2022-TSHML_ Token Shuffling under Haircut","Wang-2023-Distributed and Secure Federated Lea","Wu-2023-Master-Slave Blockchain Framework_ Cro","Xu-2018-An Energy-Aware Virtual Machine Schedu","Xu-2020-Data Pricing for Blockchain-based Car","Xu-2021-WChain_ A Fast Fault-Tolerant Blockcha","Zhao-2022-A Distributed Photovoltaic Power Tra","Zhao-2022-Scheme of Peer-to-Peer Trade in Mult"
17,"Amoussou-Guenou-2021-Rational Behaviors in Com","Antoniou-2023-Financial Data, Blockchain, Deci","Bespalov-2022-Game theory analysis of incentiv","Brunjes-2020-Reward Sharing Schemes for Stake","Chen-2023-Gacha Game Analysis and Design","Dhamal-2023-A game theoretic framework for dis","Dimitri-2022-Quadratic Voting in Blockchain Go","Du-2022-Anti-Collusion Multiparty Smart Contra","Gersbach-2020-Vote Delegation and Malicious Pa","Jia-2022-To EVM or Not to EVM_ Blockchain Comp","Kiayias-2021-Incentives against power grabs or","Kiffer-2021-HaPPY-Mine_ Designing a Mining Rew","Kovalchuk-2023-A Game-Theoretic Analysis of De","Lee-2019-Economic analysis of blockchain techn","Lee-2019-Strategies for quantum races","Li-2020-Security analysis of paxos mechanism d","Liu-2021-Analysis of Accounting Fraud in Enter","Motaqy-2021-Bet and Attack_ Incentive Compatib","Narang-2019-Design of Trusted B2B Market Platf","Pan-2021-Dividend or No Dividend in Delegated","Qin-2021-Malice-Aware Transaction Forwarding i","Qin-2022-Generous or Selfish_ Weighing Transac","Ranchal-Pedrosa-2021-Rational Agreement in the","Ranchal-Pedrosa-2022-Trap_ The Bait of Rationa","Salau-2022-Making Blockchain Validators Honest","Singh-2020-A game theoretic analysis of resour","TSP_CMC_32549","Wang-2022-Why Riding the Lightning_ Equilibriu","Winzer-2019-Temporary censorship attacks in th","Yan-2022-Collusion-free for Cloud Verification","Zappalà-2021-Game theoretical framework for an","Zhang-2023-Dynamic Evolutionary Game-based Mod","Zhen-2017-Zero-determinant strategy for the al"
18,"Akhtar-2020-Blockchain based auditable access","Alharbi-2021-A Blockchain Based Secure IoT Sol","Amarasinghe-2022-SUPPLYDECK - A Blockchain-Bas","Ammbika-2019-Block-chain technology -security","Baashar-2021-Toward blockchain technology in t","Bamakan-2022-Patents and intellectual property","Barka-2021-Sthm_ A secured and trusted healthc","Bellavista-2020-An Edge-based Distributed Ledg","Benaich-2022-Securing Big Data-Based Smart App","Bhattacharya-2021-Coalition of 6G and Blockcha","Bohara-2021-Adversarial artificial intelligenc","Bornelus-2020-Integrating blockchain technolog","Buja-2022-Into the Look_ Security Issues, Cryp","Casado-Vara-2020-Cooperative algorithm to impr","Ch-2021-Combining Blockchain Multi Authority a","Chakravarty-2018-Blockchain-enhanced Identitie","Chen-2020-Blockchain and the Feature of Game D","Chen-2023-DSVN_ A Flexible and Secure Data-Sha","Choi-2022-On-Demand Ride-Hailing Service Platf","Dong-2018-A method of image privacy protection","Du-2019-A blockchain-based random number gener","El-dosuky-2019-SPAINChain_ Security, Privacy","El-dosuky-2020-Using IoT and Blockchain for He","El-dosuky-2021-Handling Industrial Consumer Ri","Ferrag-2021-The Performance Evaluation of Bloc","Gambhire-2018-Business Potential and Impact of","Gamundani-2018-An Overview of Potential Authen","Ghajar-2022-Schloss_ Blockchain-Based System A","Gheitanchi-2020-An autonomous loyalty program","Gracanin-2019-Next generation smart built envi","Grida-2022-Are smart contracts too smart for S","Gupta-2021-Block-D2D_ Blockchain-enabled Coope","Hammoud-2022-A Novel Blockchain-Integrated Dis","Hannon-2019-Bitcoin payment-channels for resou","He-2018-Toward Privacy-Assured Health Insuranc","He-2019-A Smart Contract Grammar to Protect Io","He-2019-Securing over-the-air IoT firmware upd","Henderi-2022-A Blockchain-Based Framework Gami","Hu-2021-Blockchain-based public ecosystem for","Iqbal-2023-Blockchain Technology and Decentral","Izem-2022-Blockchain technology_ A bibliograph","JSIR 82(01) 50-62","Jain-2021-Framework for Securing IoT Ecosystem","Jaramillo-Alvar-2022-A Blockchain Solution for","Jo-2020-Reliable Blockchain Based Stochastic G","Kaddoura-2022-SH-P2P_ Self-Healing Peer-to-Pee","Kakkar-2022-Block-CPS_ Blockchain and Non-Coop","Kakkar-2022-Blockchain and Stackleberg Game-ba","Kakkar-2022-Coalition Game and Blockchain-Base","Karandikar-2020-RenewLedger _ Renewable energy","Khaki-2021-Utilizing Blockchain Technologies w","Khanna-2022-Blockchain–Cloud Integration_ A Su","Kim-2022-Advanced Drone Swarm Security by Usin","Kim-2022-Multi-Layered Blockchain Governance G","Kordestani-2020-HapiChain_ A Blockchain-based","Korkmaz-2019-Sustainable Member Motivation Sys","Li-2021-Discussion on the Influence of 5G and","Lian-2022-Blockchain-Based Secure and Trusted","Liao-2017-Design of a Blockchain-Based Lottery","Liao-2018-Applications of blockchain technolog","Lohachab-2022-Towards Interconnected Blockchai","Maestre-2022-The application of blockchain alg","Magdy-2019-IoT Systems Internal Mapping using","Mahapatra-2022-Demonstration of Integration of","Manchanda-2020-Neoteric security and privacy s","Mecheva-2020-Cybersecurity in intelligent tran","Mercan-2022-Blockchain-Based Two-Factor Authen","Mishra-2021-Blockchain Technology Empirical St","Mkrttchian-2021-The Impact of Blockchain Techn","Monteiro-2021-APTM_ A model for pervasive trac","Muthe-2020-A Blockchain Based Decentralized Co","Paduraru-2022-Enhancing the security of gaming","Patel-2021-GiNA_ A Blockchain-based Gaming sch","Qin-2021-An empirical study of DeFi liquidatio","Rahman-2020-A feedback system using blockchain","Rajashekaragoud-2020-Block-chain implementatio","Ramesh-2022-Under lock and key_ Incorporation","Rawat-2018-IShare_ Blockchain-Based Privacy-Aw","Rozman-2021-Emergence of a scale-free network","Saleh-2020-Practical Privacy Measures in Block","Samanta-2021-ToSSecC_ Two-Stage Solution for S","Samanta-2023-Secure 6G Communication in Smart","Schulz-2019-A multichain architecture for dist","Sharma-2021-Divergent applications of Blockcha","Sharma-2022-Frontiers of Blockchain for Railwa","Shrivastava-2022-Designing a Secure Vehicular","Suchaad-2018-Blockchain use in home automation","Sudeep-2022-Blockchain_ A New Era of Technolog","Sunny-2022-Blockchain-enabled beer game_ a sof","Surekha-2022-Blockchain Framework for Cognitiv","TSP_CMC_24794","Tian-2020-Research on distributed blockchain-b","Truong-2023-Blockchain Meets Metaverse and Dig","Verma-2023-Application of Machine Learning in","Vishwa-2019-A Blockchain based approach for mu","Wanganoo-2021-Harnessing Smart Integration_ Bl","Waseem-2023-Incorporation of Blockchain Techno","Wenhao-2020-A Blockchain-Based Online Game Des","Xu-2022-Research on Blockchain in Cloud Manufa","Yakubu-2023-A Privacy-Enabled, Blockchain-Base","Yang-2021-Design and Implementation of Energy"
19,Akkaoui-2020-An Evolutionary Game-Theoretic Tr,Anoaica-2018-Quantitative Description of Inter,Cano-1990-Coagglutination test (COA) for Crypt,Cao-2022-Hierarchical Reinforcement Learning f,Chai-2021-A Hierarchical Blockchain-Enabled Fe,Chen-2020-A Secure Content Sharing Scheme Base,Ding-2022-A Peer-2-Peer Management and Secure,El Gamal-2019-A Single Coin Monetary Mechanism,Esposito-2018-Securing collaborative deep lear,Feng-2018-Cyber Risk Management with Risk Awar,Fernando-2022-Proof of Sense_ A Novel Consensu,Gupta-2022-Gene Determination Algorithm_ A Blo,Hassija-2020-A Distributed Framework for Energ,Hu-2021-Decentralized Consensus Decision-Makin,Kang-2019-Incentivizing consensus propagation,Kano-2018-An alternative approach to blockchai,Khaikaew-2020-Development of the Voting System,Li-2021-Cyber Insurance Design for Validator R,Lin-2019-Making Knowledge Tradable in Edge-AI,Ling-2022-Hash Access in Blockchain Radio Acce,Liu-2019-A Novel Debt-Credit Mechanism for Blo,Mothukuri-2022-FabricFL_ Blockchain-in-the-Loo,Oktian-2019-Serious game for blockchain educat,Raju-2017-Identity management using blockchain,Srinivasan-2020-Hierarchical design and execut,Taghizadeh-2020-Mean Field Game for Equilibriu,Varma-2023-A Non-Cooperative Resource Utilizat,Wang-2023-Incentive Mechanism Design for Joint
20,Afaq-2022-Mobile-based Patient-centric EMR Sha,Kumar-2020-Lightweight proof of game (LPoG)_ A,Lopez‐barreiro-2022-Use of Blockchain Technolo,Pandi-Perumal-2021-The Blockchain Never Sleeps
