Topic,Article_Name
1,"21_Bauk","Adams-2018-A critical look at cryptogovernance","Afaq-2022-Mobile-based Patient-centric EMR Sha","Agbo-2021-Scientific production and thematic b","Agmon-2022-Distributed Ledger Technology (DLT)","Ahmad-2022-MOOC 5.0_ A Roadmap to the Future o","Ahmed-2022-The Digital and Cyberspace Moderniz","Aini-2022-iLearning education based on gamific","Akgul-2022-Blockchain-based Cryptocurrency Pri","Al Shehhi-2022-Using a Hybrid Approach of Game","Alharbi-2021-A Blockchain Based Secure IoT Sol","Amarasinghe-2022-SUPPLYDECK - A Blockchain-Bas","Ammbika-2019-Block-chain technology -security","Arif-2020-A Blockchain-Based Multiplayer Trans","Arif-2021-A Scoring System for Multiplayer Gam","Arif-2023-Decentralized recommender system for","Arnedo-Moreno-2022-Research opportunities in t","Aysan-2021-Blockchain-based solutions in achie","Baashar-2021-Toward blockchain technology in t","Batarlienė-2021-Claims solutions using a block","Baur-2015-Cryptocurrencies as a disruption_ em","Benaich-2022-Securing Big Data-Based Smart App","Besancon-2019-Towards blockchain interoperabil","Bezerra-2022-Teaching software processes from","Bhattacharya-2021-Coalition of 6G and Blockcha","Bhattacharya-2022-Incentive Mechanisms for Sma","Bhattacharya-2023-Towards Future Internet_ The","Block-2021-The entrepreneurial finance markets","Blockchain_Technology_Exploring_Opportunities_","Bohara-2021-Adversarial artificial intelligenc","Bolsens-2020-Scalable system and silicon archi","Bornelus-2020-Integrating blockchain technolog","Bucchiarone-2021-Guest Editorial Diversificati","Bucea-Manea-țon-2021-Blockchain technology enh","Bucea-Manea-țon-2022-Artificial Intelligence P","Buja-2022-Into the Look_ Security Issues, Cryp","Canbay-2022-Privacy Concerns and Measures in M","Cano-1990-Coagglutination test (COA) for Crypt","Carlson-2019-Safe artificial general intellige","Carnevale-2020-Ethics and Decisions in Distrib","Casado-Vara-2019-Blockchain-based distributed","Casado-Vara-2020-Cooperative algorithm to impr","Centobelli-2022-Blockchain technology design i","Chao-2022-The Study of DeFi in Virtual Communi","Chen-2020-Blockchain and the Feature of Game D","Chernikov-2020-Waste management industry from","Choi-2022-Blockchain-Centered Educational Prog","Choi-2022-Development of Blockchain Learning G","Corrales Compag-2020-Legal Aspects of Decentra","Cu-2021-Blockchain-Based Governance in Fractio","Çulha-2022-Gamification of Open Inquiry-based","Davidová-2022-Co-De_GT_ The Gamification and T","De Boeck-2023-Data, analytical techniques and","De Villiers-2020-A Three-Tier Framework for Un","Dettling-2020-Bloxxgame – A Simulation Game fo","Dhewanto-2022-Towards Policy Development of En","Dos Santos-2019-Blockchain_ Status-quo, enable","Driessen-2021-Validated Data Quality Assessmen","Duh-2019-Publish-and-flourish_ Using blockchai","Dutta-2020-Blockchain vs GDPR in Collaborative","El-dosuky-2020-Using IoT and Blockchain for He","Espina-Romero-2022-What Are the Topics That Bu","Faical-2023-A Cyber-Physical System&#x0027;s R","Feng-2022-An analysis of the current status of","Ferreira-2019-A Blockchain and Gamification Ap","Filippova-2019-Empirical evidence and economic","Fosso Wamba-2019-Continuance intention in bloc","Fu-2023-A Survey of Blockchain and Intelligent","Gamal-2022-Challenges and Opportunities of Blo","Gambhire-2018-Business Potential and Impact of","Gamidullaeva-2023-A Design Concept for a Touri","Gammon-2018-Experimenting with blockchain_ Can","Gao-2021-An empirical study on the adoption of","Gaushik-2022-A Prototype Design for Gamified B","Gleim-2021-Blockchain_ a game changer for mark","González-Tablas-2020-Shuffle, cut, and learn_","Goyanes-2020-Value and Intelligence of Busines","Gracanin-2019-Next generation smart built envi","Guidi-2022-Social games and Blockchain_ explor","Guo-2021-Enabling Massive IoT Toward 6G_ A Com","He-2018-Toward Privacy-Assured Health Insuranc","Henderi-2022-A Blockchain-Based Framework Gami","Hickman-2020-Data sharing_ using blockchain an","Hong-2022-A Study on Corporate Information Ass","Hossain-2022-Cyber Threats and Scams in FinTec","Hudson‐smith-2022-Incoming Metaverses_ Digital","Huh-2019-XR collaboration architecture based o","Jain-2021-Framework for Securing IoT Ecosystem","Jaramillo-Alvar-2022-A Blockchain Solution for","Jha-2023-COVID-19 Triggers a Paradigm Shift in","Kanchanaratanak-2022-Opportunities and Barrier","Kapsammer-2017-IVOLUNTEER - A digital ecosyste","Kedziora-2020-Anti-Cheat tool for detecting un","Kera-2020-Anticipatory policy as a design chal","Khanna-2022-Blockchain–Cloud Integration_ A Su","Kim-2021-Adding Interactivity to Education of","Kim-2022-Advanced Drone Swarm Security by Usin","Kolesnikov-2020-Efficient and secure logistics","Kordestani-2020-HapiChain_ A Blockchain-based","Korkmaz-2019-Sustainable Member Motivation Sys","Kosmarski-2021-Anthropology and blockchain","Kumar-2022-Evolving Role of Sustainable Procur","Kurkin-2021-Corporate Database Management on t","Lado-2019-Behavioral Dynamics and Regulation o","Lara-2020-Special issue on the current trends","Li-2018-CAPTCHA_ Machine or human solvers_ a g","Liao-2022-A Federated Blockchain Approach for","Lin-2022-Metaverse in Education_ Vision, Oppor","Lohachab-2022-Towards Interconnected Blockchai","Lu-2022-_sc_iQuery__sc__ A Trustworthy and Sca","Maestre-2022-The application of blockchain alg","Magdy-2019-IoT Systems Internal Mapping using","Mahapatra-2022-A Hybrid Connected Approach of","Manchanda-2020-Neoteric security and privacy s","Manzoor-2020-Scavenger hunt_ Utilization of bl","Martins-2019-Collaborative Gamified Approach f","Miranda-2022-Quantum Brain Networks_ A Perspec","Mishra-2020-Prospero’s Books_ A Distributed Ar","Mkrttchian-2021-The Impact of Blockchain Techn","Monteiro-2021-APTM_ A model for pervasive trac","Moradi-2018-MetaSyCar_ A System for Metabolic","Musamih-2022-NFTs in Smart Cities_ Vision, App","Nabeeh-2022-Evaluation of Production of Digita","Naderi-2022-Leveraging Blockchain Technology a","Nguyen-2022-SoChainDB_ A Database for Storing","Niu-2021-Impacts of Managerial Overconfidence","Nugraha-2021-Improving multi-sport event ticke","Ozpinar-2023-A Hyper-Integrated Mobility as a","Paajala-2022-Users’ Perceptions of Key Blockch","Paduraru-2022-Enhancing the security of gaming","Panachev-2021-Application of blockchain techno","Pandi-Perumal-2021-The Blockchain Never Sleeps","Parizi-2018-On the understanding of gamificati","Patrickson-2021-What do blockchain technologie","Peters-2021-Building human security and an ent","Pittaras-2021-Beacons and blockchains in the m","Polas-2022-Blockchain Technology as a Game Cha","Pradana-2022-A Multi-Criteria Recommender Syst","Predescu-2021-A serious gaming approach for cr","Puglisi-2022-Evolving Regulatory Frameworks_ B","Raghav-2022-Reimaging Indian Healthcare using","Rahman-2019-A Blockchain-Based Non-Invasive Cy","Rahman-2020-A feedback system using blockchain","Ramesh-2022-Under lock and key_ Incorporation","Razmjooei-2023-Industry 4.0 research in the ma","Revolutionizing Tropical Medicine - 2019 - Atk","Rottondi-2017-A privacy-friendly gaming framew","Saeidnia-2023-Non-fungible tokens (NFT)_ a saf","Saltykov-2018-Theory Game as Priority Area of","Samanta-2023-Secure 6G Communication in Smart","Sandaruwan-2020-Towards an Efficient and Secur","Saritha-2021-Integration of Artificial Intelli","Schulz-2019-A multichain architecture for dist","Seneviratne-2022-Blockchain for Social Good_ C","Serna Gómez-2021-Advances, Opportunities, and","Shah-2021-A Framework for Designing Self-susta","Shaheen-2021-A track donation system using blo","Sharma-2022-Frontiers of Blockchain for Railwa","Shcherba-2021-Blockchain and games_ A novel mi","Sifah-2020-BEMPAS_ A Decentralized Employee Pe","Silvestru-2022-Smart Academic and Professional","Stepanyan-2022-Neuroeconomic Modeling of Distr","Sun-2022-Matrix World - A Programmable 3D Mult","Sunny-2022-Blockchain-enabled beer game_ a sof","Suvajdzic-2020-Discover DaVinci - A Gamified B","Ten-2022-Engineering Blockchain Enabling Win A","Terzi-2022-A Life-Long Learning Education Pass","Thenjono-2022-The Business Prospect in Metaver","Thomas-2022-Gallery Defender_ Integration of B","Thrassou-2022-An Overview of Business Advancem","Trovò-2021-Ants-Review_ A Privacy-Oriented Pro","Truong-2023-Blockchain Meets Metaverse and Dig","Tuomas Harviain-2022-Cryptogames as Drivers fo","Uribe-Saldarria-2022-What If_ A Robot Challeng","Veeningen-2018-Using serious gaming to discove","Verma-2023-Application of Machine Learning in","Voicu-Dorobantu-2021-Using Blockchain for Opti","Waseem-2023-Incorporation of Blockchain Techno","Webster-2018-Sharing is Caring_ Collaborative","Weng-2019-Integrating the Combination of Block","Wernbacher-2022-HotCity—A Gamified Token Syste","Wijayathilaka-2020-Secured, intelligent blood","Wu-2018-Design of Evaluation System for Digita","Xin-2020-Reciprocal crowdsourcing_ Building co","Xiong-2022-Delay-Aware Cooperative Caching for","Yang-2021-Design and Implementation of Energy","Yang-2022-Fusing Blockchain and AI With Metave","Yang-2023-Non-Fungible Token (NFT) Games_ A Li","Yau-2022-Powering Financial Literacy Through B","Yfantis-2022-Using Gamification to Address the","Yilmaz-2022-Examining the Use of Non-fungible","Ying-2023-DVIT—A Decentralized Virtual Items T","Zagar-2021-Distributed applications in gamific","Zandee-2022-Aiming for bullseye_ a novel gamep","Zeng-2022-WANA Wallet_ The Application Design","Zhao-2022-Evolutionary Game and Simulation Res","Zheng-2019-FinBrain_ when finance meets AI 2.0"
2,"Alamer-2018-A Privacy-preserving incentive fra","Ayaz-2020-A Voting Blockchain based Message Di","Ayaz-2021-Blockchain-Enabled Security and Priv","Barhanpure-2019-Proof of stack consensus for b","Barka-2021-Sthm_ A secured and trusted healthc","Bellavista-2020-An Edge-based Distributed Ledg","Bhat-2020-Evaluation and design of performable","Bi-2023-IoT_ A Decentralized Trust Management","Bordel-2022-Distributed Trust and Reputation S","Borse-2022-A Review of Blockchain Consensus Al","Cai-2020-A Blockchain-Based Crowdsourcing Syst","Ch-2021-Combining Blockchain Multi Authority a","Chakravarty-2018-Blockchain-enhanced Identitie","Chen-2019-Secure Electricity Trading and Incen","Dai-2018-Learning Based Security for VANET wit","Du-2019-A blockchain-based random number gener","Du-2022-Anti-Collusion Multiparty Smart Contra","El-dosuky-2019-SPAINChain_ Security, Privacy","Erfan-2022-Game-theoretic Designs for Blockcha","Feng-2018-Competitive Data Trading in Wireless","Ferrag-2021-The Performance Evaluation of Bloc","Gamundani-2018-An Overview of Potential Authen","Gao-2019-Blockchain enabled distributed cooper","Ghajar-2022-Schloss_ Blockchain-Based System A","Gheitanchi-2020-An autonomous loyalty program","Guo-2022-Blockchain-based Reputation Evaluatio","Gupta-2019-Colosseum_ A scalable permissioned","Gupta-2021-Block-D2D_ Blockchain-enabled Coope","Gupta-2022-Game Theory‐Based Authentication Fr","Hammoud-2022-A Novel Blockchain-Integrated Dis","Han-2019-Blockchain Based Spectrum Sharing Alg","Hao-2012-Mixed-strategy game based trust manag","Hassija-2020-A Framework for Secure Vehicular","He-2018-A Blockchain Based Truthful Incentive","He-2019-Securing over-the-air IoT firmware upd","He-2022-NetChain_ A Blockchain-Enabled Privacy","Hu-2020-Blockchain-Aided Flow Insertion and Ve","Hu-2021-Blockchain-based public ecosystem for","Islam-2021-Blockchain-Enabled Intelligent Vehi","JSIR 82(01) 50-62","Jia-2018-A blockchain-based location privacy p","Jiang-2022-GaS-PBFT_ A Game-based Node Selecti","Jo-2020-Reliable Blockchain Based Stochastic G","Kaddoura-2022-SH-P2P_ Self-Healing Peer-to-Pee","Kakkar-2022-Blockchain and Stackleberg Game-ba","Kalra-2018-Blockchain-based real-time cheat pr","Khaki-2021-Utilizing Blockchain Technologies w","Khalid-2021-A Secure Trust Method for Multi-Ag","Khezr-2022-Towards a Trustful Game-Theoretic M","Kim-2019-New blockchain adoptation for automot","Kim-2021-Enhanced IoV security network by usin","Kim-2022-Multi-Layered Blockchain Governance G","Liang-2022-GAIMMO_ A Grade-driven Auction-base","Liao-2020-Proof-of-balance_ Game-theoretic con","Lv-2020-Blockchain based spectrum sensing_ A g","Ma-2019-Design of Routing Incentive Protocol f","Mahapatra-2022-Demonstration of Integration of","Mecheva-2020-Cybersecurity in intelligent tran","Mercan-2022-Blockchain-Based Two-Factor Authen","Nguyen-2019-Enabling On-demand decentralized I","Nie-2022-Blockchain-Empowered Secure and Priva","Patel-2021-GiNA_ A Blockchain-based Gaming sch","Peng-2022-Blockchain-assisted D2D Data Sharing","Qi-2022-Security Evaluation Model of Blockchai","Qiao-2020-Dynamic autonomous cross consortium","Rani-2022-Improvement of energy conservation u","Rawat-2018-IShare_ Blockchain-Based Privacy-Aw","Saleh-2020-Practical Privacy Measures in Block","Samanta-2021-ToSSecC_ Two-Stage Solution for S","Sampath-2020-Spot collaborative shipping sans","Shao-2019-Blockchain-Based SDN Security Guaran","Sharadqh-2023-Hybrid Chain_ Blockchain Enabled","Sharma-2021-Divergent applications of Blockcha","Shi-2022-Threat Intelligence Sharing Model and","Shrivastava-2022-Designing a Secure Vehicular","Stodt-2023-Introducing a Fair Tax Method to Ha","Suchaad-2018-Blockchain use in home automation","Suo-2023-Proof of Travel for Trust-Based Data","Surekha-2022-Blockchain Framework for Cognitiv","TSP_CMC_24794","TSP_CMC_32549","TSP_CSSE_25461","Tian-2020-Research on distributed blockchain-b","Tian-2022-Efficient Mobile Vehicle Data Sharin","Toyoda-2019-Mechanism Design for An Incentive-","Uushona-2021-Network Forensics in a BYOD Envir","Vishwa-2019-A Blockchain based approach for mu","Wang-2020-A Secure and Credible Supply Chain S","Wang-2021-A MADM Location Privacy Protection M","Wang-2021-DCrowd_ A Decentralized Service Mode","Wei-2021-A Modified Blockchain DPoS Consensus","Wilczynski-2021-Security aspects in blockchain","Wilczyński-2022-Blockchain-Based Task and Info","Wu-2020-Group Activity Matching with Blockchai","Wu-2021-Enhanced Game Theoretical Spectrum Sha","Wu-2023-Master-Slave Blockchain Framework_ Cro","Xiong-2021-Security and Privacy in Mobile Crow","Yakubu-2023-A Privacy-Enabled, Blockchain-Base","Yang-2018-Decentralized blacklistable anonymou","Yang-2021-PMAB_ A Public Mutual Audit Blockcha","Zhang-2019-VeSenChain_ Leveraging consortium b","Zhu-2020-An Improved Proof-of-Trust Consensus","Zou-2021-Reputation-based regional federated l"
3,"Bamakan-2022-Patents and intellectual property","Bonifazi-2023-Performing Wash Trading on NFTs_","Delfabbro-2021-The psychology of cryptocurrenc","Dong-2018-A method of image privacy protection","Fowler-2021-Tokenfication - The potential of n","Huang-2017-Behavior pattern clustering in bloc","Kano-2017-A new approach to mining work in blo","Karapapas-2022-Decentralized NFT-based Evolvab","Krasnoselskii-2023-KRAMER_ Interpretable Rarit","Kuehn-2021-A Practical Tool-Chain for the Deve","Lin-2022-A Peek at Metaverse Society from Web","Lischke-2016-Analyzing the bitcoin network_ Th","Nadini-2021-Mapping the NFT revolution_ market","Posavec-2022-Non-Fungible Tokens_ Might Learni","Quiles Pérez-2021-Breaching Subjects' Thoughts","Rahrouh-2022-The Potential Application of NFT","Serada-2021-Vintage CryptoKitties and the Ques","Smith-2022-The Spectacular Collapse of Cryptok","Tasca-2018-The evolution of the bitcoin econom","Valeonti-2021-Crypto collectibles, museum fund","Wang-2022-Attention Economy in Metaverse_ An N","Wang-2022-Toward Understanding Attention Econo","White-2022-Characterizing the OpenSea NFT Mark","Zheng-2022-Multimodal Learning for Improved NF"
4,"Akhtar-2020-Blockchain based auditable access","Alefs-2022-Secure Decentralized Online Gaming","Arora-2022-Smart Contracts and NFTs_ Non-Fungi","Asgaonkar-2019-Solving the Buyer and Seller's","Badash-2021-Blockchain-based bug bounty framew","Barreiro-Gomez-2019-Blockchain token economics","Bartoletti-2021-A Theory of Automated Market M","Bartoletti-2022-A THEORY OF AUTOMATED MARKET M","Belotti-2020-Game theoretical analysis of cros","Beniiche-2021-Robonomics in the 6G Era_ Playin","Benini-2021-Power and Pitfalls of Generic Smar","Besancon-2022-A Blockchain Ontology for DApps","Boron-2021-Alternative authentication with sma","Burkert-2022-Decentralized Online Multiplayer","Cai-2019-Demo Abstract_ An Interoperable Avata","Chatterjee-2018-Quantitative analysis of smart","Chen-2019-Lottery dapp from multi-randomness e","Chen-2020-A Survey on Ethereum Systems Securit","Chepurnoy-2019-Multi-stage Contracts in the UT","Ciampi-2022-FairMM_ A Fast and Frontrunning-Re","Daian-2020-Flash boys 2.0_ Frontrunning in dec","Danos-2021-Revisiting the liquidity_risk trade","Distefano-2020-MOATcoin_ Exploring challenges","Dubovitskaya-2021-A Game-Theoretic Analysis of","Ellul-2022-SoliNomic_ A Self-modifying Smart C","Finogeev-2018-Blockchain and smart contracts f","Galal-2023-Aegis_ Privacy-Preserving Market fo","Gamage-2020-A Survey on Blockchain Technology","Gamidullaeva-2019-Smart contracts for multi-ag","Gomez-2022-Watch Your Back_ Identifying Cyberc","Guidi-2022-Sleepminting, the brand new frontie","Gürsoy-2020-Using Ethereum blockchain to store","Hannon-2019-Bitcoin payment-channels for resou","Hari-2023-T-PASS_ A Blockchain-based NFT Enabl","Harkanson-2020-A Framework for Decentralized P","He-2020-Smart Contract Vulnerability Analysis","Heimbach-2022-Eliminating Sandwich Attacks wit","Hu-2020-Analyzing smart contract interactions","Huang-2022-Temporal Analysis of Transaction Eg","Huang-2022-Who is gambling_ Finding cryptocurr","Ibba-2022-Analysis of the Relationship between","Iqbal-2023-Blockchain Technology and Decentral","Izem-2022-Blockchain technology_ A bibliograph","Ji-2021-Security Analysis of Blockchain Smart","Jia-2019-DeLottery_ A novel decentralized lott","Karapapas-2021-Fully Decentralized Trading Gam","Kerr-2018-How can legislators protect sport fr","Kirillov-2022-Rental NFT Protocol With Advance","Kraft-2022-Horizontal Scalability of Blockchai","Latifi-2019-Blockchain-based real estate marke","Li-2019-Decentralized release of self-emerging","Li-2020-Dynamic Gas Estimation of Loops Using","Li-2020-Trace-Based Dynamic Gas Estimation of","Li-2021-Discussion on the Influence of 5G and","Liao-2017-Design of a Blockchain-Based Lottery","Liao-2018-Applications of blockchain technolog","Libin-2021-Agent-Oriented Modelling for Blockc","Liu-2020-Towards automated verification of sma","Liu-2021-Characterizing key agents in the cryp","Maksymyuk-2019-Blockchain-based intelligent ne","McCorry-2017-Atomically trading with roger_ Ga","McCorry-2020-You Sank My Battleship! A Case St","Merrad-2022-Robust Decentralized Proof of Loca","Migliorini-2019-A Blockchain-based solution to","Migliorini-2019-The Rise of Enforceable Busine","Min-2019-A security case study for blockchain","Moti-2020-Orthos_ A Trustworthy AI Framework f","Muthe-2020-A Blockchain Based Decentralized Co","Nam-2022-Formal Verification of Blockchain Sma","Neiheiser-2020-HRM smart contracts on the bloc","Nikhil-2022-Instigating Decentralized Apps wit","Pan-2019-Building a blockchain simulation usin","Papathanasiou-2023-R_ddle_ A Fully Decentraliz","Phillips-2020-Tracing Cryptocurrency Scams_ Cl","Ragnoni-2021-System and Methods for Blockchain","Sahitya-2021-D-Lotto_ The Lottery DApp with Ve","Sako-2021-Fairness in ERC Token Markets_ A Cas","Shashikiran-2021-Minimal Block Knight’s Tour a","Spoto-2022-On the use of generic types for sma","Stengele-2018-Atomic Information Disclosure of","Sudeep-2022-Blockchain_ A New Era of Technolog","Tang-2022-A Graph Neural Network-based Code Re","Tikhomirov-2018-Ethereum_ State of knowledge a","Trojanowska-2020-Secure Decentralized Applicat","Tsabary-2021-MAD-HTLC_ Because HTLC is crazy-c","Vairagade-2022-Proposal on NFT Minter for Bloc","Wu-2022-CCOM_ Cost-Efficient and Collusion-Res","Xia-2017-Enhanced TLS handshake authentication","Xu-2020-Improving the Efficiency of Blockchain","Xu-2021-A game-theoretic analysis of cross-cha","Zhang-2020-On modeling blockchain-enabled econ","Zhao-2019-Y-DWMS_ A digital watermark manageme","Zhao-2020-CloudArcade_ A blockchain empowered","Zhou-2018-Trustworthy cloud service level agre","Zhou-2019-A Blockchain based Witness Model for","Zhou-2021-Enforcing trustworthy cloud SLA with","Zhou-2021-High-frequency trading on decentrali","Zhou-2022-Behavior-Aware Account De-Anonymizat","Zhu-2022-Making Smart Contract Classification","Zhukov-2019-Fintech ecosystem the largest priv"
5,Adler-2018-Astraea_ A Decentralized Blockchain,Alzahrani-2018-Towards true decentralization_,Amoussou-Guenou-2021-Rational Behaviors in Com,Aruna-2020-Highly secured blockchain based ele,Bacis-2021-I Told You Tomorrow_ Practical Time,Bhudia-2022-Extortion of a Staking Pool in a P,Bracciali-2021-Decentralization in open quorum,Brunjes-2020-Reward Sharing Schemes for Stake,Chatterjee-2019-Probabilistic smart contracts_,Chen-2017-Decentralized execution of smart con,Chen-2019-The game among bribers in a smart co,Chen-2021-An incentive-compatible rational sec,Chen-2022-Maximal Information Propagation via ,Christodoulou-2020-Consensus crash testing_ Ex,Dey-2019-Securing Majority-Attack in Blockchai,Dimitri-2022-Quadratic Voting in Blockchain Go,Eisele-2022-Decentralized Computation Market f,Fooladgar-2020-On Incentive Compatible Role-Ba,Gersbach-2020-Vote Delegation and Malicious Pa,Hardwick-2018-E-Voting with Blockchain_ An E-V,Jain-2022-Tiramisu_ Layering Consensus Protoco,Kara-2021-A compute and wait in pow (Cw-pow) c,Kiayias-2020-A puff of steem_ Security analysi,Kiayias-2021-Coalition-safe equilibria with vi,Kiayias-2021-Incentives against power grabs or,Kovalchuk-2023-A Game-Theoretic Analysis of De,Leonardos-2020-Oceanic Games_ Centralization R,Liu-2020-Game Theoretic Approach for Secure an,Lu-2019-On enabling machine learning tasks ato,Lu-2020-Generic superlight client for permissi,Manshaei-2018-A Game-Theoretic Analysis of Sha,Mazorra-2022-Price of MEV_ Towards a Game Theo,McMenamin-2021-Achieving state machine replica,McMenamin-2022-FairTraDEX_ A Decentralised Exc,Moore-2022-Fortuna_ A Novel Staked Voting Syst,Motaqy-2021-Bet and Attack_ Incentive Compatib,Motepalli-2021-Reward Mechanism for Blockchain,Nabi-2020-Game-Theoretic Analysis of an Incent,Nelaturu-2020-On Public Crowdsource-Based Mech,Nguyen-2021-Blockchain-based Secure platform f,Ovezik-2022-Decentralization Analysis of Pooli,Pan-2021-Dividend or No Dividend in Delegated,Paul-2020-Smart Contract-Driven Mechanism Desi,Potop-Butucaru-2021-Blockchains and the Common,Rana-2022-Free2Shard_ Adversary-resistant Dist,Ranchal-Pedrosa-2021-Rational Agreement in the,Ranchal-Pedrosa-2022-Trap_ The Bait of Rationa,Sai-2019-Disincentivizing double spend attacks,Sako-2022-Distributed Random Number Generation,Salau-2022-Making Blockchain Validators Honest,Schwartzbach-2021-An incentive-compatible smar,Sel-2018-Towards solving the data availability,Shanmuga Skandh-2022-Analysis of Cryptocurrenc,Stifter-2019-Avoiding Risky Designs When Using,Sun-2019-Moral hazard in games of miners (shor,Tošić-2021-A DECENTRALIZED AUTHORITATIVE MULTI,Yan-2022-Collusion-free for Cloud Verification,Yuen-2019-Proof-of-play_ A Novel Consensus Mod,Zappalà-2020-Brief announcement_ Game theoreti,Zappalà-2021-Game theoretical framework for an,Zhang-2022-DeFi '22_ ACM CCS Workshop on Decen,Zhu-2019-A proposal for account recovery in de
6,Cheng-2022-A Blockchain-Based Trust Model for,Giraldo-2020-Electronic Voting Using Blockchai,Hemati-2021-An incentive compatible reward sha,Kim-2019-Two-phase cooperative bargaining game,Liyuan-2019-E2C-Chain_ A two-stage incentive e,Nguyen-2019-Proof-of-Stake Consensus Mechanism,Quan-2021-Intra-Shard and Inter-Shard Collabor,Ruan-2021-Catfish Effect Between Selfish Miner,Siomos-2019-Syriza's Populism_ Testing and Ext,Swathi-2021-An analysis on blockchain consensu,Tao-2020-On sharding open blockchains with sma,Uz Zaman-2020-Decentrally-consented-server-bas,Wen-2022-Optimal Block Propagation and Incenti,Wenhao-2020-A Blockchain-Based Online Game Des,Xu-2021-URIM_ Utility-Oriented Role-Centric In,Xu-2022-A Survey of Blockchain-Based Crowd Sen,Yang-2022-User-Centric Blockchain for Industry,Ye-2021-A Recommendation Scheme with Reputatio,Yun-2019-MMOG user participation based decentr
