Topic,Article_Name
23,"Abishu-2022-Consensus Mechanism for Blockchain","Aggarwal-2022-PETS_ P2P Energy Trading Schedul","Akkaoui-2020-An Evolutionary Game-Theoretic Tr","Anoaica-2018-Quantitative Description of Inter","Ayaz-2021-A Proof-of-Quality-Factor (PoQF)-Bas","Ayaz-2022-A Blockchain Based Federated Learnin","Bai-2022-Public Participation Consortium Block","Barnawi-2023-Path Planning for Energy Manageme","Bu-2021-Validating Knowledge Contents with Blo","Cao-2022-Hierarchical Reinforcement Learning f","Cao-2023-Blockchain Systems, Technologies, and","Chai-2021-A Hierarchical Blockchain-Enabled Fe","Chen-2020-A Secure Content Sharing Scheme Base","Chen-2022-Joint pricing and task allocation fo","Cheng-2022-SBA-GT_ A Secure Bandwidth Allocati","Choi-2019-Game theoretical approach of blockch","Ding-2022-A Peer-2-Peer Management and Secure","El Gamal-2019-A Single Coin Monetary Mechanism","Esposito-2018-Securing collaborative deep lear","Feng-2019-Dynamic Sensor Renting in RF-powered","Fernando-2020-Blockchain-based Wi-Fi offloadin","Fernando-2022-Proof of Sense_ A Novel Consensu","Fu-2020-Integrated Resource Management for Ter","Gheitanchi-2020-Gamified service exchange plat","Ghosh-2019-Strategic Prosumers_ How to Set the","Guan-2022-Fair Outsourcing Polynomial Computat","Guo-2021-A Blockchain-Enabled Ecosystem for Di","Guo-2022-An Architecture for Distributed Energ","Gupta-2022-Gene Determination Algorithm_ A Blo","Hassan-2020-DEAL_ Differentially Private Aucti","Hassija-2020-A Blockchain-Based Framework for 3","Hassija-2020-A Distributed Framework for Energ","Hassija-2020-A blockchain-based framework for","Hassija-2020-DAGIoV_ A Framework for Vehicle t","Hu-2020-A Blockchain-Based Reward Mechanism fo","Hu-2020-An Evolutionary Game Assisted Spectrum","Hu-2021-Decentralized Consensus Decision-Makin","Hu-2021-Securing SDN-Controlled IoT Networks t","Hu-2022-Leveraging Blockchain for Multi-Operat","Huang-2023-Blockchain-Assisted Personalized Ca","Hui-2022-BCC_ Blockchain-Based Collaborative C","Jameel-2021-Efficient Mining Cluster Selection","Kakkar-2022-Block-CPS_ Blockchain and Non-Coop","Kakkar-2022-Coalition Game and Blockchain-Base","Kang-2019-Incentivizing consensus propagation","Kano-2018-An alternative approach to blockchai","Lee-2023-Facing to Latency of Hyperledger Fabr","Li-2018-Consortium blockchain for secure energ","Li-2019-Decentralized On-Demand Energy Supply","Li-2021-Cyber Insurance Design for Validator R","Li-2021-Electric Vehicle Peer-to-Peer Energy T","Li-2023-Multi-Operator Dynamic Spectrum Sharin","Lin-2019-Making Knowledge Tradable in Edge-AI","Lin-2021-Blockchain-Based On-Demand Computing","Ling-2022-Hash Access in Blockchain Radio Acce","Liu-2018-Evolutionary game for mining pool sel","Liu-2018-Resource Allocation for Video Transco","Liu-2019-A Novel Debt-Credit Mechanism for Blo","Liu-2019-Decentralized Resource Allocation for","Liu-2019-Optimal Pricing Mechanism for Data Ma","Liu-2020-Efficient QoS Support for Robust Reso","Lu-2022-Say No to Price Discrimination_ Decent","Luo-2022-Blockchain-Enabled Two-Way Auction Me","Mai-2023-Cloud Mining Pool Aided Blockchain-En","Mothukuri-2022-FabricFL_ Blockchain-in-the-Loo","Oktian-2019-Serious game for blockchain educat","Patel-2021-Blockchain-Envisioned Trusted Rando","Qiu-2020-Blockchain-Based Secure Spectrum Trad","Raju-2017-Identity management using blockchain","Sabounchi-2017-Towards resilient networked mic","Said-2021-A Decentralized Electricity Trading","Seng-2021-User Matching on Blockchain for Comp","Singh-2018-Blockchain_ A game changer for secu","Srinivasan-2020-Hierarchical design and execut","Taghavi-2020-A Blockchain-Based Model for Clou","Taghizadeh-2020-Mean Field Game for Equilibriu","Tang-2020-Incentivizing Honest Mining in Block","Torky-2022-Scheduling and Securing Drone Charg","Tsaousoglou-2020-Truthful, Practical and Priva","Varma-2023-A Non-Cooperative Resource Utilizat","Wang-2018-Decentralized Caching for Content De","Wang-2022-A Secure and Efficient Wireless Char","Wang-2022-BSIF_ Blockchain-Based Secure, Inter","Wang-2022-Blockchain-Based Secure and Cooperat","Xia-2020-A Bayesian Game Based Vehicle-to-Vehi","Xiaolin-2020-Combined output optimization base","Xing-2022-UAVs Assisted Secure Blockchain Offl","Xing-2022-UAVs-Aided Delay-Tolerant Blockchain","Xu-2018-Game theoretic study on blockchain bas","Xu-2019-A blockchain-enabled trustless crowd-i","Xu-2020-Data Pricing for Blockchain-based Car","Xu-2021-WChain_ A Fast Fault-Tolerant Blockcha","Yan-2021-Blockchain for Transacting Energy and","Yang-2020-Automated Demand Response Framework","Yang-2022-Hierarchical Blockchain Design for D","Yang-2022-Reputation Mechanism Designed for Bl","Yin-2021-A Blockchain-Based Storage System wit","Zhang-2022-A Blockchain Enhanced Coexistence o","Zhang-2022-Demand-Response Games for Peer-to-P","Zhao-2022-A Secure Intra-Regional-Inter-Region","Zheng-2022-Cooperative Spectrum Sensing and Fu","Zhou-2020-Secure and Efficient Vehicle-to-Grid"
24,"10.3934%2Fjimo.2022087","Adamashvili-2021-Blockchain-based wine supply","Avyukt-2021-A decentralized review system for","Bauer-2020-Is there a market for trusted car d","Behl-2022-Assessing retailer readiness to use","Cao-2022-Evolutionary Game of Supply Chain All","Cao-2022-Optimal Operation Policies in a Cross","Cheng-2021-Traceability Management Strategy of","Choi-2022-On-Demand Ride-Hailing Service Platf","Ding-2022-Optimal Decision and Coordination of","Ding-2023-Blockchain Adoption among Multi-Stak","El-dosuky-2021-Handling Industrial Consumer Ri","Grida-2022-Are smart contracts too smart for S","Guo-2021-Optimized Combination of e-commerce P","Guo-2022-Supply Chain Governance of Agricultur","Guo-2022-The Marketing of Cross-border E-comme","Guo-2023-Applications of Blockchain Technology","Hassija-2019-BlockCom_ A blockchain based comm","Hayrutdinov-2020-Coordination of Supply Chain","Hellwig-2022-Playing with DISASTER_ A Blockcha","Hrušovský-2022-Battling the Bullwhip Effect wi","Hu-2021-Blockchain or not_ Optimal decisions f","Huo-2022-Evolutionary Game Analysis of Standar","Islam-2022-Transparency-privacy Trade-off in B","Jain-2020-Blockchain in logistics industry_ in","Jia-2022-To EVM or Not to EVM_ Blockchain Comp","Jiang-2022-Research on carbon emission reducti","Ko-2018-Blockchain technology and manufacturin","Ko-2023-Supply chain transparency as a signal","Kong-2020-Game Studies on Accounting Entity Be","Lee-2019-Economic analysis of blockchain techn","Li-2022-Research on Green Supply Chain Decisio","Liao-2022-Governmental Anti-Pandemic and Subsi","Liu-2021-Evolutionary game analysis of Chinese","Liu-2021-Pricing and coordination of vaccine s","Liu-2021-Supply Chain Decision Model Based on","Liu-2022-The provision strategy of blockchain","Lotfi-2021-Viable Supply Chain Network Design","Lotfi-2022-Resource-constrained time–cost-qual","Lotfi-2022-Viable supply chain with vendor-man","Luo-2022-E-commerce supply chains with conside","Luo-2022-Information Sharing Game and Value An","Ma-2022-Research on optimization of food suppl","Manzoor-2022-Blockchain technology in supply c","Mishra-2021-Blockchain Technology Empirical St","Pranesh-2020-Design and Analysis of Incentive","Pu-2021-The Impact of Covid-19 on Blockchain A","Rabieinejad-2021-Blockchain-based E-commerce f","Rajashekaragoud-2020-Block-chain implementatio","Sodamin-2022-Fair Label versus Blockchain Tech","Song-2022-Blockchain Adoption in Agricultural","Song-2022-Blockchain’s role in e-commerce sell","Song-2023-Impact of Government Subsidies, Comp","Su-2021-Visualizing sustainable supply chain m","Sun-2021-Mechanism analysis of applying blockc","Sun-2023-Strategy Analysis of Fresh Agricultur","Tan-2022-The Safe Financial Processing Method","Violino-2019-Are the innovative electronic lab","Wan-2022-Evolutionary game study on the govern","Wang-2021-Application of blockchain technology","Wang-2022-Recycling Model Selection for Electr","Wanganoo-2021-Harnessing Smart Integration_ Bl","Wu-2023-Platform-leading blockchain adoption f","Xiaocong-2021-Optimization of biomass collecti","Xie-2022-Research on Evolutionary Game of Supp","Xin-2022-Incentive and Game of Information Sha","Xu-2022-Differential Game Model of Information","Xu-2023-What influences stakeholders' decision","Yang-2022-BLOCKCHAIN-BASED COLLABORATIVE MANAG","Yang-2022-Decisions for Blockchain Adoption an","Ye-2022-Early Adopter or Follower&#x003F; The","Yin-2021-Research on Resource Carbon Emission","Zhang-2022-Optimal Pricing Decisions for Dual-","Zheng-2022-Blockchain-based intelligent contra","Zheng-2022-Retraction Note_ Blockchain-based i","Zheng-2022-Supply chain quality level decision","Zheng-2023-Blockchain Traceability Adoption in","Zhou-2022-Information Disclosure Decision for","Zhu-2020-Pricing strategy and system performan"
26,Chen-2021-Detecting Smart Contract Loopholes B,Chen-2023-Gacha Game Analysis and Design,Großschädl-2000-High-Speed RSA hardware based,Narang-2019-Design of Trusted B2B Market Platf,Smirnov-2019-Robot Coalition Formation Based o,Smirnov-2020-Usage of Smart Contracts with FCG
27,Fournaris-2008-Creating an Elliptic Curve arit,Khaikaew-2020-Development of the Voting System,Pu-2020-Blockchain adoption time of shipowners
29,"Alzahrani-2020-A new product anti-counterfeiti","Bala-2022-A novel game theory based reliable p","Blockchain for Business - 2021 - Tyagi - Ether","Blockchain for Business - 2021 - Tyagi - The S","Cao-2022-Credible and economic multimedia serv","Chen-2021-SmartStore_ A blockchain and cluster","Chen-2021-Trusted audit with untrusted auditor","Elarabany-2022-Evaluating anti-obesity potenti","Hughes-2017-Blockchain, The Greater Good, and","Liao-2018-Inkjet-Printed Random Lasers","Machine Learning Approach for Cloud Data Analy","Pilipenko-2019-GABA-containing compound gammap","Qin-2021-An empirical study of DeFi liquidatio","Quantum Blockchain - 2022 - Dhanaraj - Post%E2","Ramamurthy-1992-High-Performance Liquid Chroma","Sharma-2021-Game of names_ Blockchain premium","Venkateswararar-2022-BandBlock_ Bandwidth allo","Wang-2022-STSIIML_ Study on token shuffling un","Xu-2021-An Optimal Stability Matching Algorith","Yang-2020-IPBSM_ An optimal bribery selfish mi","Zade-2022-Evaluating the added value of blockc"
30,Biström-2015-Taxonomic revision of afrotropica,Zhang-2020-High-quality extraction method of e
