Topic,Article_Name
7,Bataineh-2020-A game-based secure trading of b,Bu-2020-Toward Blockchain-Assisted Gamified Cr,Chen-2022-DIM-DS_ Dynamic Incentive Model for,Chuang-2020-TIDES_ A Trust-Aware IoT Data Econ,El-Dosuky-2019-DOORchain_ Deep Ontology-Based,Fu-2019-Bead Strand Model_ a high-efficiency s,Ghanem-2022-FLoBC_ A Decentralized Blockchain-,Gürsoy-2020-Using blockchain to log genome dat,Harris-2019-Decentralized and collaborative AI,Huang-2020-Fair and Protected Profit Sharing f,Huang-2023-Profit Sharing for Data Producer an,Jayaprakash-2021-A systematic review of energy,Jin-2022-Detecting Arbitrage on Ethereum Throu,Li-2019-EdgeCare_ Leveraging Edge Computing fo,Li-2021-Healthchain_ Secure EMRs Management an,Lian-2022-Blockchain-Based Secure and Trusted,Lin-2019-An Evaluation of Bitcoin Address Clas,Qi-2022-High-Quality Model Aggregation for Blo,Qu-2021-Proof of Federated Learning_ A Novel E,Qu-2022-Future Research Directions,Rizwan-2021-SAID_ ECC-Based Secure Authenticat,Salau-2021-Data cooperatives for neighborhood,Saxena-2022-Integration of Back-Propagation Ne,Sun-2022-A Novel Layered GSP Incentive Mechani,Sun-2022-GAME-BC_ A Graph Attention Model for,Taghavi-2018-Cloudchain_ A blockchain-based co,Toyoda-2018-Multi-Class Bitcoin-Enabled Servic,Vakilinia-2023-An Incentive-Compatible Mechani,Weng-2021-FedServing_ A federated prediction s,Wu-2020-Game theory for mobile location privac,Zhang-2020-Transaction community identificatio,Zhang-2022-Economic Analysis of Decentralized,Zhu-2019-An Incentive Mechanism Using Shapley,Zola-2019-Bitcoin and cybersecurity_ Temporal,Zola-2020-Generative Adversarial Networks for
8,Asheralieva-2020-Reputation-Based Coalition Fo,Asheralieva-2021-Bayesian Reinforcement Learni,Dhamal-2023-A game theoretic framework for dis,Makiyama-1965-On some problems concerning the,Scholten-2020-Inside the decentralised casino_,Yuan-2022-Edge mining resources allocation amo
9,1903.11172,Brache-2021-Relational Capital and Blockchain_,Delfabbro-2022-Understanding the mechanics and,Delic-2022-Profiling the Potential Risks and B,Jiang-2022-Economic Analysis of Loot Box Marke,Jiang-2022-Towards Understanding Player Behavi,Komiya-2019-Increasing Motivation for Playing,Lee-2019-Is a Blockchain-Based Game a Game for,Li-2019-BanFEL_ A Blockchain Based Smart Contr,Min-2019-Blockchain games_ A survey,Pfeiffer-2020-Blockchain Technologies and Game,Scholten-2019-Ethereum crypto-games_ Mechanics,Serada-2020-Why Is CryptoKitties (Not) Gamblin,Serada-2022-Fairness by Design_ The Fair Game,Wang-2019-Rhythm dungeon_ A blockchain-based m,Wu-2020-Infinity Battle_ A Glance at How Block,Xin-2020-Stability and Hopf Bifurcation of a S,Yaklai-2020-An architecture for game to game d,Yao-2022-Freedom and Restraint in Dark Forest_,da Silva-2021-Real and Virtual Token Economy A
10,Avarikioti-2019-Payment Networks as Creation G,Avarikioti-2020-Ride the Lightning_ The Game T,Bai-2022-Understanding the Benefit of Being Pa,Du-2019-Anlysis and design of activity degree,Ge-2021-A Privacy Protection Method of Lightwe,Gupta-2022-Integration of blockchain with emer,Hu-2020-Sync or Fork_ Node-Level Synchronizati,Kanemura-2018-Design of privacy-preserving mob,Pickhardt-2020-Imbalance measure and proactive,Qi-2022-Collusion Attack Analysis and Detectio,Sadkhan-2019-Hybrid Strategies for Choosing Su,Shan-2021-Research on Collaborative Governance,Thakur-2020-Collusion Attack from Hubs in The,Zhang-2021-A Transaction Transmission Model fo,Zhang-2023-Transaction transmission model for,Zhao-2022-Research on Information Propagation
11,"Antoniou-2023-Financial Data, Blockchain, Deci","Breiki-2022-Trust Evolution Game in Blockchain","Cao-2019-Application of ZD strategy in mining","Chen-2021-Evolutionary Equilibrium Analysis fo","Chen-2022-Toward Prevention of Parasite Chain","Cheng-2018-A hashing power allocation game in","Cheng-2021-A hashing power allocation game wit","Cheng-2021-The evolutionary equilibrium of blo","Du-2019-A biform game approach to preventing b","Han-2022-A Two-layer Game-based Incentive Mech","Hu-2019-A game theoretic analysis on block wit","Jiang-2020-A game-theoretic approach to storag","Jin-2018-Evolutionary game analysis on permiss","Kiffer-2021-HaPPY-Mine_ Designing a Mining Rew","Kim-2019-Mining Pool Manipulation in Blockchai","Kovacs-2021-A collaborative game theory approa","Li-2019-DQN for Multi-layer Game Based Mining","Li-2020-Security analysis of paxos mechanism d","Liu-2020-A Distributed Game Theoretic Approach","Lou-2018-Research on the Cooperative Behavior","Ni-2019-Evolutionary Game for Consensus Provis","Qin-2021-Malice-Aware Transaction Forwarding i","Qin-2022-Generous or Selfish_ Weighing Transac","Shao-2021-On Strategic Interactions in Blockch","Shi-2021-Fee-Free Pooled Mining for Countering","Singh-2020-A game theoretic analysis of resour","Spiegelman-2021-Game of coins","Tang-2020-Cooperative Mining in Blockchain Net","Toda-2021-Game-Theoretic Approach to a Decisio","Wang-2019-Pool strategies selection in pow-bas","Wang-2022-PoTA_ A hybrid consensus protocol to","Wang-2022-Why Riding the Lightning_ Equilibriu","Wu-2022-Committee Selection Based on Game Theo","Xu-2020-Dynamic Selection of Mining Pool with","Zhang-2020-Game-theoretic Modeling and Stabili","Zhang-2021-Cooperation Mechanism in Blockchain","Zhang-2023-Dynamic Evolutionary Game-based Mod","Zhen-2017-Zero-determinant strategy for the al"
12,Amir Latif-2019-Blockchain Transforms the Reta,Armani-2019-Seamless Grid_ An off-chain model,Grillo-2022-Fashion and Metaverse_ an exposito,He-2019-A Smart Contract Grammar to Protect Io,Huang-2019-Implementing an asset trading syste,Laih-1989-A new scheme for ID-based cryptosyst,Lu-2023-Safety Warning! Decentralised and Auto,Rozman-2021-Emergence of a scale-free network,Slavnenko-2021-Enhancing Privacy Through DMMA_,Wang-2020-Game Strategy of Environmental Regul,Wang-2022-A Platform-Free Proof of Federated L,Wang-2022-TSHML_ Token Shuffling under Haircut,Xu-2018-An Energy-Aware Virtual Machine Schedu,Zhao-2022-A Distributed Photovoltaic Power Tra,Zhao-2022-Scheme of Peer-to-Peer Trade in Mult,Zhou-2021-Data Trading for Blockchain-Based Da
13,10.3934%2Fjimo.2020049,Chen-2021-User distributions in shard-based bl,Hu-2020-A Correlated Equilibrium based Transac,Kruminis-2022-Game-Theoretic Analysis of an Ex,Li-2018-Blockchain queue theory,Li-2018-Transaction Queuing Game in Bitcoin Bl,Li-2019-Bitcoin Fee Decisions in Transaction C,Li-2022-A Novel GSP Auction Mechanism for Dyna,Li-2022-Analyzing Bitcoin transaction fees usi,Liu-2020-Economics of Blockchain Storage,Liu-2022-A Storage Sustainability Mechanism Wi,Liu-2022-An Incentive Mechanism for Sustainabl,Qi-2020-Nash Equilibrium and Social Optimizati,Yan-2020-Dynamic Game Model for Ranking Bitcoi
14,Liu-2022-Ready Raider One_ Exploring the Misus,Xu-2022-Research on Blockchain in Cloud Manufa
15,Guo-2020-Blockchain-enabled demand response sc,He-2023-Blockchain-Based P2P Content Delivery,Ji-2022-Selection Game for Consensus-Based Dec,Okanami-2020-Load balancing for sharded blockc,Okanami-2022-Load Balancing with In-Protocol_W,Parikh-2019-GaN Power Commercialization with H,Riehl-2020-Transaction Pricing for Maximizing
16,Aizawa-2016-Invariant partial differential equ,Kirabo-2017-Neuregulin-1β induces proliferatio
17,"Abate-2021-SSProve_ A Foundational Framework f","Agrawal-2017-Stronger security for reusable ga","Agrawal-2019-Attribute Based Encryption (and m","Alghabashi-2018-A finite multi-dimensional gen","Alwen-2012-Collusion-preserving computation","Arapinis-2021-Astrolabous_ A Universally Compo","Badertscher-2021-A Rational Protocol Treatment","Bai-2016-Improved reduction from the bounded d","Baum-2016-How to prove knowledge of small secr","Bespalov-2022-Game theory analysis of incentiv","Bhattacharyya-2023-Subversion Resilient Hashin","Bitansky-2013-Why _Fiat-Shamir for proofs_ lac","Braverman-2019-Optimal short-circuit resilient","Braverman-2022-Optimal Short-Circuit Resilient","Broadnax-2021-Environmentally Friendly Composa","Brzuska-2014-Using indistinguishability obfusc","Canetti-2012-Universally composable security w","Chongchitmate-2017-Resettably-sound resettable","Ciet-2004-Transient fault induction attacks on","David-2018-21 - Bringing down the complexity_","Du-2022-Enhancing Cryptocurrency Blocklisting_","Elumar-2021-On the Connectivity and Giant Comp","Gambs-2015-The crypto-democracy and the trustw","Ganesh-2022-Secure Auctions in the Presence of","Gao-2019-BFR-MPC_ A blockchain-based fair and","Garay-2020-Resource-Restricted Cryptography_ R","Glaeser-2022-Foundations of Coin Mixing Servic","Goharshady-2021-Irrationality, Extortion, or T","Hall-Andersen-2021-Game Theory on the Blockcha","He-2021-Fair Peer-to-Peer Content Delivery via","Hubáček-2013-Limits on the power of cryptograp","Ishai-2012-On efficient zero-knowledge PCPs","Jafargholi-2017-Be adaptive, avoid overcommitt","Kamath-2021-On Treewidth, Separators and Yao’s","Kozachinskiy-2020-Multiparty Karchmer - Wigder","Kumaresan-2015-How to use bitcoin to play dece","Liu-2017-Quantum security analysis of a lattic","Lohr-2022-Formalizing Cost Fairness for Two-Pa","Maji-2021-Computational Hardness of Optimal Fa","Mittelbach-2013-Cryptophia's short combiner fo","Mittelbach-2014-Salvaging indifferentiability","Naito-2016-New bounds for keyed sponges with e","Park-2018-SpaceMint_ A Cryptocurrency Based on","Saleh-2007-Verifying security properties of cr","Tekiner-2021-SoK_ Cryptojacking malware","Tochner-2020-How to Pick Your Friends A Game T","Ventre-2008-Completely non-malleable encryptio","Yasuda-2012-PMAC with parity_ Minimizing the q","Yu-2019-Re-thinking untraceability in the cryp"
18,Alhojärvi-2020-Hacking finance_ experiments wi,Campbell-2018-Digitalization of tax_ Epistemic,Cheng-2023-Incentive-Driven Information Sharin,Gambo-2021-Effect of the Fourth Industrial Rev,Liu-2019-Distributed K-Anonymity Location Priv,Liu-2021-Analysis of Accounting Fraud in Enter,Luo-2022-Comparative Research on the Game Beha,Mou-2021-Game-Theoretic Analysis on CBDC Adopt,Pan-2021-Incentive Mechanism Design for Distri,Proskuryakov-2021-Predictive-Free Methods for,Qiang-2021-Block chain algorithm rationality o,Read-2020-Libra Project_ Regulators Act on Glo,Su-2022-Blockchain-Driven Optimal Strategies f,Sun-2021-Evolutionary game analysis of blockch,Veuger-2018-Trust in a viable real estate econ,Xie-2022-Study on Enterprise Financial Risk Pr,Zhang-2023-Multi-Party Evolutionary Game Analy,Zhao-2022-Evolutionary game of banks and enter,Zhou-2021-Game Analysis of _Blockchain+Supply,Zhu-2023-Three-Party Stochastic Evolutionary G
19,Agrawal-2020-Adaptive Simulation Security for,Alwen-2021-Modular Design of Secure Group Mess,Anderson-2006-Cryptographic processors - A sur,Balli-2020-Determining the Core Primitive for,Bojinov-2014-Neuroscience meets cryptography_,Broadbent-2020-Towards quantum one-time memori,Broadbent-2021-Towards quantum one-time memori,Budiman-2020-A Crypto Compression System Using,Cambou-2020-Securing additive manufacturing wi,Chatzigiannis-2022-Homomorphic Decryption in B,Chen-2020-Application of Homomorphic Encryptio,Chen-2022-A New NFT Model to Enhance Copyright,Chen-2022-Searching for Encrypted Data on Bloc,Chen-2023-DSVN_ A Flexible and Secure Data-Sha,Chhatrapati-2022-A Performance Evaluation of P,Dachman-Soled-2014-A black-box construction of,Dookie-2020-Building an Inclusive Distributed,Ehara-2019-How to generate transparent random,Fouque-2004-Blockwise Adversarial Model for On,Frankel-1995-Cryptanalysis of the immunized LL,Gama-2007-New chosen-ciphertext attacks on NTR,Gamage-2000-High performance agile crypto modu,Guo-2022-Labrador_ towards fair and auditable,Hussein-2006-Randomized cryptosystems attacks,Kanth-2022-Blockchain-based Authenticated Steg,Kırlar-2018-A game-theoretical and cryptograph,Lee-2019-Strategies for quantum races,Lin-2018-An ID-Based Linearly Homomorphic Sign,Liu-2011-Security model of mobile online games,Luong-2023-Privacy-Preserving Identity Managem,Oh-2022-A Secure Personal Health Record Sharin,Paşca-2018-Challenges in cyber security_ Ranso,Qiu-2022-Fine-grained Access Control Method fo,Sadkhan-2019-Best Strategies of Choosing Crypt,Sahai-2011-Fully secure accountable-authority,Seo-2022-Reminisce_ Blockchain Private Key Gen,Sepehri-2017-Efficient implementation of a pro,Simic-2020-A review on generating random numbe,Simmons-1985-The subliminal channel and digita,Tomaz-2022-Blockchain-based whistleblowing ser,Valli Kumari-2010-Secure group key distributio,Wang-2022-A Blockchain Consensus Protocol Base,Wei-2016-Simple and fast identity-based encryp,Wu-2018-Fair electronic voting via bitcoin dep,Xiao-2021-Secure and Efficient Multi-Signature,Xu-2021-Chosen-Ciphertext Secure Key Encapsula,Yuan-2013-Public key timed-release searchable,Zhai-2022-Research on the Storage and Sharing,Zhang-2014-A new multivariate based threshold,Zhu-2022-Traceable Scheme of Public Key Encryp
20,Abegaz-2023-Blockchain-Based Resource Trading,Asheralieva-2020-Distributed Dynamic Resource,Asheralieva-2021-Learning-Based Mobile Edge Co,Baek-2020-Privacy-preserving and trustworthy d,Bai-2022-Trustworthy Blockchain-Empowered Coll,Boateng-2022-Blockchain-Enabled Resource Tradi,Boateng-2022-Consortium Blockchain-Based Spect,Cao-2021-A Multi-Agent Reinforcement Learning,Chai-2019-Proof-of-Reputation Based-Consortium,Chang-2020-Incentive Mechanism for Edge-Comput,Chang-2021-Blockchain-Empowered Drone Networks,Chen-2019-Cooperative and Distributed Computat,Chen-2022-ABSNFT_ Securitization and Repurchas,Chen-2022-Internet of Vehicles Resource Schedu,Ding-2021-An Incentive Mechanism for Building,Ding-2022-Pricing and Budget Allocation for Io,Du-2020-Optimal Computation Resource Allocatio,Du-2022-Blockchain-Aided Edge Computing Market,Fan-2020-Stackelberg game based edge computing,Fan-2021-Cloud_Edge Computing Resource Allocat,Fan-2021-Three-stage Stackelberg game based ed,Fan-2022-CryptoArcade_ A Cloud Gaming System w,Fan-2022-Mobile Devices Strategies in Blockcha,Fang-2021-Joint Distributed Cache and Power Co,Feng-2018-Cyber Risk Management with Risk Awar,Feng-2021-On Cyber Risk Management of Blockcha,Fu-2023-Game model of optimal quality experien,Guo-2020-Blockchain Meets Edge Computing_ Stac,Guo-2020-Edge Network Resource Synergy for Mob,Guo-2020-Resource allocation for edge computin,Guo-2021-Incentive Mechanism Design for Blockc,Guo-2022-Incentive Mechanism for Edge Computin,Hassija-2020-A Blockchain based Framework for,Hassija-2021-A mobile data offloading framewor,Hewa-2022-Demo_ Blockchain-based Secured and F,Hewa-2023-Blockchain and Game Theory Convergen,Hewa-2023-Blockchain-Based Network Slice Broke,Hu-2022-BC-MCSDT_ A Blockchain-based Trusted M,Huang-2020-Securing parked vehicle assisted fo,Huang-2021-Blockchain-Enabled Task Offloading,Huang-2021-Privacy-Enhanced Crowdsourcing Data,Huang-2021-Stackelberg Game Based Resource Pri,Huang-2022-Edge Resource Pricing and Schedulin,Jiang-2019-Hierarchical edge-cloud computing f,Jiang-2020-Game theoretic storage outsourcing,Jiang-2022-IIoT Data Sharing Based on Blockcha,Jiang-2022-Multi-Leader Multi-Follower Stackel,Jiang-2023-Reliable Distributed Computing for,Jiao-2019-Auction mechanisms in cloud_fog comp,Jing-2023-Joint resource trading and computati,Karakus-2021-QoSChain_ Provisioning Inter-AS Q,Khan-2022-A Survey on Mobile Edge Computing fo,Kwantwi-2023-Blockchain-Based Computing Resour,Lang-2022-Cooperative Computation Offloading i,Lei-2022-GBRM_ a graph embedding and blockchai,Li-2021-NOMA-Enabled Cooperative Computation O,Li-2022-Edge Blockchain Construction Efficienc,Liang-2022-Resource Competition in Blockchain,Liao-2021-Information-centric massive iot-base,Lin-2022-Blockchain-Based Incentive Energy-Kno,Liu-2022-Blockchain Based Offloading Strategy_,Mazumdar-2022-Strategic Analysis of Griefing A,Nguyen-2020-Blockchain and Stackelberg Game Mo,Nguyen-2022-BlockRoam_ Blockchain-Based Roamin,Nguyen-2022-MetaChain_ A Novel Blockchain-base,Nguyen-2023-Cooperative Task Offloading and Bl,Nguyen-2023-FedChain_ Secure Proof-of-Stake-ba,Qiu-2019-Online deep reinforcement learning fo,Ramneek-2022-A Lightweight and Secure Vehicula,Ren-2022-AI-Bazaar_ A Cloud-Edge Computing Pow,Seid-2022-Blockchain-Enabled Task Offloading W,Seid-2023-Blockchain-Empowered Resource Alloca,Su-2021-A Cooperative Game Theory and Blockcha,Sun-2022-Against Colluding Mining with Reward,Sun-2022-Joint Mining Offloading and Computing,Tang-2022-Incentivizing Proof-of-Stake Blockch,Wadhwa-2022-Optimal Resource Allocation by Rev,Wang-2019-Blockchain-based resource allocation,Wang-2022-A Game for Task Offloading in Reputa,Wang-2022-InFEDge_ A Blockchain-Based Incentiv,Wang-2022-Mean-Field Learning for Edge Computi,Wang-2023-Distributed and Secure Federated Lea,Wang-2023-Incentive Mechanism Design for Joint,Wei-2020-Block Mining or Service Providing_ A,Wu-2018-Optimal computational power allocation,Wu-2020-An Effective Resource Allocation Appro,Wu-2020-Revenue-sharing based computation-reso,Xi-2019-Perishable digital goods trading mecha,Xiao-2022-Consortium Blockchain-Based Computat,Xie-2021-Secure Data Sharing in UAV-assisted C,Xiong-2018-Optimal pricing-based edge computin,Xiong-2019-Cloud_fog computing resource manage,Xiong-2020-Cloud_Edge Computing Service Manage,Xu-2021-Edge Computing Resource Allocation for,Xu-2023-IDADET_ Iterative Double-sided Auction,Yacob-2022-An Optimal Incentive Mechanism for,Yang-2022-Joint Optimization of Edge Computing,Yang-2022-Two-Level Stackelberg Game for IoT C,Yao-2019-Resource trading in blockchain-based,Zhang-2018-Energy-Aware Task Offloading for Ul,Zhang-2019-Joint Computation Offloading and Co,Zhang-2019-Mining task offloading in mobile ed,Zhang-2021-Resource sharing of mobile edge com,Zhang-2022-Computing Resources Sharing Network,Zhao-2019-Coalition Game-Based Computation Res,Zhao-2020-A robust incentive consensus propaga,Zheng-2020-Blockchain-Based Vehicular Collabor,Zhou-2018-Blockchain and Edge Computing Based,Zuo-2020-Computation Resource Allocation in Mo,Zuo-2021-Blockchain Storage and Computation Of,Zuo-2021-Computation Offloading in Untrusted M,Zuo-2021-Delay-Limited Computation Offloading
21,"1912.06412","Aponte-Novoa-2021-The 51% Attack on Blockchain","Arenas-2020-Cryptocurrency mining games with e","Ballard-2020-Blockchain_ The facts and fiction","Benaddi-2021-Securing IoT Transactions Against","Bentov-2021-Tortoise and Hares Consensus_ The ","Bhattacherjee-2023-Voting Games to Model Proto","Biais-2019-The Blockchain Folk Theorem","Boreiri-2022-A Novel Consensus Protocol in Blo","Chang-2019-Uncle-block attack_ Blockchain mini","Chang-2020-Dynamic power control for rational","Chatterjee-2018-Ergodic mean-payo games for th","Chen-2020-A brief introduction to blockchain e","Chen-2020-Decentralized mining pool games in b","Chen-2021-Impact of Temporary Fork on the Evol","Chen-2022-TIPS_ Transaction Inclusion Protocol","Cheng-2019-Mining strategies for completing th","Di Stefano-2020-Resolution of Blockchain Confl","Di-2019-The Consensus Games for Consensus Econ","Di-2020-The Framework of Consensus Equilibria","Elliott-2019-Nash Equilibrium of Multiple, Non","Ferreira-2021-Proof-of-Stake Mining Games with","Fujita-2020-Mining Pool Selection Problem in t","Fujita-2021-Mining pool selection under block","Goren-2019-Mind the mining","Huang-2020-Incentive Assignment in PoW and PoS","Huang-2021-Do the Rich Get Richer_ Fairness An","Ilie-2021-Unstable throughput_ When the diffic","Jebari-2022-Analysis of Blockchain Selfish Min","Jeyasheela Rakk-2022-Comprehensive overview on","Jiang-2019-Bitcoin mining with transaction fee","Jiang-2021-On Game-theoretic Computation Power","Kaci-2020-PoolCoin_ Toward a distributed trust","Kaci-2020-Toward a Machine Learning and Softwa","Kiayias-2016-Blockchain mining games","Kim-2018-A Novel Bitcoin Mining Scheme Based o","Koutsoupias-2019-Blockchain mining games with","Kraner-2022-Agent-based Modelling of Bitcoin C","Kumar-2020-Proof of Game (PoG)_ A game theory","Kumar-2021-Proof of Game (PoG)_ A Proof of Wor","Lamiri-2019-Bitcoin difficulty, a security fea","Lee-2020-Proof-of-stake at stake_ Predatory, d","Leelavimolsilp-2019-Selfish Mining in Proof-of","Leva-2019-Control-oriented modelling of proof-","Li-2020-Mining Pool Game Model and Nash Equili","Li-2020-Rational Protocols and Attacks in Bloc","Li-2021-The Miner's Dilemma with Migration","Li-2022-The Miner&#x2019;s Dilemma With Migrat","Liu-2019-A Survey on Blockchain_ A Game Theore","Liu-2019-Decentralization is Vulnerable Under","Luu-2015-On Power Splitting Games in Distribut","Mirkin-2020-BDoS_ Blockchain Denial-of-Service","Nojoumian-2019-Incentivizing blockchain miners","Okada-2022-Sending Spies as Insurance Against","Pass-2017-FruitChains_ A fair blockchain","Ray-2018-A Mechanism Design Approach to Blockc","Samanta-2021-Quantified Analysis of Security I","Tötzer-2019-Blockchain as a game changer in en","Tsabary-2018-The gap game","Tyagi-2022-Game Theory-Based Proof of Stake Mi","Wang-2019-A Survey on Consensus Mechanisms and","Wang-2021-Game-Theoretical Analysis of Mining","Wang-2022-Arbitrage Attack_ Miners of the Worl","Wang-2022-Blockchain-based multi-malicious dou","Wang-2022-SDoS_ Selfish Mining-Based Denial-of","Wang-2023-Dissecting Mining Pools of Bitcoin N","Wen-2022-Exploration of Mined Block Temporaril","Winzer-2019-Temporary censorship attacks in th","Xu-2019-MWPoW_ Multiple Winners Proof of Work","Yao-2022-Equilibrium Analysis of Block Withhol","Yu-2020-Game Theoretic Analysis of Reputation","Zhang-2022-Insightful Mining Equilibria","Zheng-2019-New Game-Theoretic Analysis of DDoS","Zolotavkin-2019-Incentives for stable mining i","Zolotavkin-2019-Time-dependent decision-making"
22,Afzal-2020-Blockchain enabled distributed dema,Ali-2020-Efficient and Secure Energy Trading i,Bhattacharya-2022-EVBlocks_ A Blockchain-Based,Chau-2019-Peer-to-peer energy sharing_ Effecti,Chen-2020-Loaning Decision for Electric Vehicl,Chen-2021-Distributed Power Trading System Bas,Cui-2020-Prosumer community_ A risk aversion e,Damisa-2022-Blockchain-Based Gas Auctioning Co,Das-2022-A Review of Challenges and Solution i,Djehiche-2019-Mean-field-type games for blockc,Doan-2021-Peer-to-peer energy trading in smart,Döbelt-2020-Peer-to-Peer Traded Energy_ Prosum,Edussuriya-2023-Peer-to-Peer Energy Trading th,Egozcue-2002-Diploid sperm and the origin of t,Ferreira-2018-Building a community of users fo,Fu-2019-Research on micro-grid group intellige,Fu-2020-Research on Block-Chain-Based Intellig,Hassija-2020-A blockchain-based framework for 2,He-2022-Combined game model and investment dec,Hu-2022-Research on Multimicrogrid Transaction,Hua-2023-Blockchain Enabled Decentralized Loca,Huang-2023-Blockchain-enabled Carbon and Energ,Kajaan-2021-Review of Market Clearing Method f,Kakkar-2022-Blockchain and IoT-Driven Optimize,Kakkar-2022-Blockchain and Zero-Sum Game-based,Karandikar-2020-RenewLedger _ Renewable energy,Krayem-2023-A game-theoretic approach to asses,Kumar-2020-Lightweight proof of game (LPoG)_ A,Li-2019-A Blockchain-based Distributed Non-coo,Li-2021-Blockchain-based Dynamic Game of Elect,Li-2021-Security Transaction Mechanism of Ener,Li-2022-Research on key technologies of P2P tr,Liang-2022-V2GNet_ Robust Blockchain-Based Ene,Liu-2020-Microgrid Trading Game Model Based on,Liu-2020-Multi-party energy management of ener,Liu-2021-Electricity market transaction model,Liu-2023-Blockchain-Based Renewable Energy Tra,Lopez‐barreiro-2022-Use of Blockchain Technolo,Makhsoos-2022-Designing a High Performance and,Mondal-2020-BIND_ Blockchain-based flow-table,Morstyn-2019-Designing decentralized markets f,Okoye-2022-Adopting the Game Theory Approach i,Ouyang-2021-Research on new energy trading sys,Sabounchi-2018-A Decentralized P2P Electricity,Samadi-2021-Energy Blockchain for Demand Respo,Samuel-2020-Leveraging blockchain technology f,Saukh-2018-Synchronization Games in P2P Energy,Stephant-2020-Increasing Photovoltaic Self-con,Stephant-2021-Increasing photovoltaic self-con,Tian-2022-Design of Joint Trading Platform for,Tushar-2020-Peer-to-Peer Trading in Electricit,Wang-2019-A secure private charging pile shari,Wang-2022-Blockchain-Based Intelligent Interco,Wu-2018-Game mechanism design of smart contrac,Xu-2019-Microgrid group trading model and solv,Xue-2022-Research on cooperation strategy betw,Yang-2021-Design of Double-chain Blockchain Ar,Yu-2018-Design and implementation of a blockch,Yu-2023-Evolutionary Game of Digital-Driven Ph,Yuan-2022-Study on Game Behavior of Power Supp,Yun-2021-Residential energy trading with block,Zhang-2023-Local power consumption method of d,Zhao-2019-Consortium blockchain-based microgri,Zhou-2020-Blockchain Based Potential Game Mode,Zhou-2022-Blockchain-based Stackelberg Game Op,Zhou-2022-Energy Block Chain Trading Mechanism
